examples/pyq_contract/.cache/tunecache_error.tsv
tunecache	1.1.0	1.1.0-e23cd7e4f-sm_86	cpu_arch=x86_64,gpu_arch=sm_86,cuda_version=12.2.140	# Last updated Thu Jul  3 15:49:49 2025

          volume	name	aux	block.x	block.y	block.z	grid.x	grid.y	grid.z	shared_bytes	aux.x	aux.y	aux.z	aux.w	time	comment
               1	N4quda7reducer11init_reduceIN4cuda3__46atomicIjLNS2_3std3__48__detail12thread_scopeE1EEEEE	GPU-offline,	32	1	1	1	1	1	0	-1	-1	-1	-1	3.40282e+38	# default
     16x16x16x16	N4quda10BlockOrthoIssLi4ELi2ELi3ELi2ELi24EEE	GPU-offline,vol=65536,parity=2,precision=2,order=8,Ns=4,Nc=72,nVec=24,block_size=8x8x4x4,n_block_ortho=1,mVec=1	1024	1	1	64	1	2	0	1	-1	-1	-1	0.0123559	# 290.24 Gflop/s, 83.26 GB/s, tuning took 0.099580 seconds at Thu Jul  3 15:47:40 2025
     16x16x16x16	N4quda10CalculateYILb0EL19QudaFieldLocation_s2ENS_13CalculateYArgILb0EfsLi4ELi2ELi3ELi24ENS_5gauge10FieldOrderIfLi48ELi2EL21QudaGaugeFieldOrder_s2ELb1EsEENS4_IfLi48ELi2ELS5_2ELb1EiEENS4_IfLi3ELi1ELS5_2ELb1EfEENS_11colorspinor12FieldOrderCBIfLi4ELi3ELi24EL16QudaFieldOrder_s8EssLb0ELb0EEESC_SC_NS_6clover10FieldOrderIfLi3ELi4EL22QudaCloverFieldOrder_s4EEEEEEE	GPU-offline,vol=65536,parity=2,precision=2,order=8,Ns=4,Nc=72,nVec=24,comm=0000,computeAV,Dynamic,GPU-device	32	1	8	1024	4	3	0	1	0	0	0	0.0133803	# 67.71 Gflop/s, 31.99 GB/s, tuning took 15.302558 seconds at Thu Jul  3 15:48:13 2025
     16x16x16x16	N4quda10CalculateYILb0EL19QudaFieldLocation_s2ENS_13CalculateYArgILb0EfsLi4ELi2ELi3ELi24ENS_5gauge10FieldOrderIfLi48ELi2EL21QudaGaugeFieldOrder_s2ELb1EsEENS4_IfLi48ELi2ELS5_2ELb1EiEENS4_IfLi3ELi1ELS5_2ELb1EfEENS_11colorspinor12FieldOrderCBIfLi4ELi3ELi24EL16QudaFieldOrder_s8EssLb0ELb0EEESC_SC_NS_6clover10FieldOrderIfLi3ELi4EL22QudaCloverFieldOrder_s4EEEEEEE	GPU-offline,vol=65536,parity=2,precision=2,order=8,Ns=4,Nc=72,nVec=24,comm=0000,computeAV,compute_max,Dynamic,GPU-device	32	1	6	1024	4	4	0	1	0	0	0	0.0133762	# 67.73 Gflop/s, 37.67 GB/s, tuning took 15.288115 seconds at Thu Jul  3 15:47:58 2025
     16x16x16x16	N4quda10CalculateYILb0EL19QudaFieldLocation_s2ENS_13CalculateYArgILb0EfsLi4ELi2ELi3ELi24ENS_5gauge10FieldOrderIfLi48ELi2EL21QudaGaugeFieldOrder_s2ELb1EsEENS4_IfLi48ELi2ELS5_2ELb1EiEENS4_IfLi3ELi1ELS5_2ELb1EfEENS_11colorspinor12FieldOrderCBIfLi4ELi3ELi24EL16QudaFieldOrder_s8EssLb0ELb0EEESC_SC_NS_6clover10FieldOrderIfLi3ELi4EL22QudaCloverFieldOrder_s4EEEEEEE	GPU-offline,vol=65536,parity=2,precision=2,order=8,Ns=4,Nc=72,nVec=24,comm=0000,computeUV,compute_max,tile_size=3x2x1,dim=0,dir=back,nFace=1,GPU-device	32	1	12	1024	2	1	16385	1	1	1	1	0.000240435	# 1884.02 Gflop/s, 1101.19 GB/s, tuning took 0.460638 seconds at Thu Jul  3 15:48:25 2025
     16x16x16x16	N4quda10CalculateYILb0EL19QudaFieldLocation_s2ENS_13CalculateYArgILb0EfsLi4ELi2ELi3ELi24ENS_5gauge10FieldOrderIfLi48ELi2EL21QudaGaugeFieldOrder_s2ELb1EsEENS4_IfLi48ELi2ELS5_2ELb1EiEENS4_IfLi3ELi1ELS5_2ELb1EfEENS_11colorspinor12FieldOrderCBIfLi4ELi3ELi24EL16QudaFieldOrder_s8EssLb0ELb0EEESC_SC_NS_6clover10FieldOrderIfLi3ELi4EL22QudaCloverFieldOrder_s4EEEEEEE	GPU-offline,vol=65536,parity=2,precision=2,order=8,Ns=4,Nc=72,nVec=24,comm=0000,computeUV,compute_max,tile_size=3x2x1,dim=0,dir=fwd,nFace=1,GPU-device	32	1	6	1024	2	2	0	1	0	0	0	0.000253696	# 1785.54 Gflop/s, 1043.63 GB/s, tuning took 0.495979 seconds at Thu Jul  3 15:48:14 2025
     16x16x16x16	N4quda10CalculateYILb0EL19QudaFieldLocation_s2ENS_13CalculateYArgILb0EfsLi4ELi2ELi3ELi24ENS_5gauge10FieldOrderIfLi48ELi2EL21QudaGaugeFieldOrder_s2ELb1EsEENS4_IfLi48ELi2ELS5_2ELb1EiEENS4_IfLi3ELi1ELS5_2ELb1EfEENS_11colorspinor12FieldOrderCBIfLi4ELi3ELi24EL16QudaFieldOrder_s8EssLb0ELb0EEESC_SC_NS_6clover10FieldOrderIfLi3ELi4EL22QudaCloverFieldOrder_s4EEEEEEE	GPU-offline,vol=65536,parity=2,precision=2,order=8,Ns=4,Nc=72,nVec=24,comm=0000,computeUV,compute_max,tile_size=3x2x1,dim=1,dir=back,nFace=1,GPU-device	32	1	12	1024	2	1	0	1	1	1	1	0.000240819	# 1881.02 Gflop/s, 1099.44 GB/s, tuning took 0.463135 seconds at Thu Jul  3 15:48:28 2025
     16x16x16x16	N4quda10CalculateYILb0EL19QudaFieldLocation_s2ENS_13CalculateYArgILb0EfsLi4ELi2ELi3ELi24ENS_5gauge10FieldOrderIfLi48ELi2EL21QudaGaugeFieldOrder_s2ELb1EsEENS4_IfLi48ELi2ELS5_2ELb1EiEENS4_IfLi3ELi1ELS5_2ELb1EfEENS_11colorspinor12FieldOrderCBIfLi4ELi3ELi24EL16QudaFieldOrder_s8EssLb0ELb0EEESC_SC_NS_6clover10FieldOrderIfLi3ELi4EL22QudaCloverFieldOrder_s4EEEEEEE	GPU-offline,vol=65536,parity=2,precision=2,order=8,Ns=4,Nc=72,nVec=24,comm=0000,computeUV,compute_max,tile_size=3x2x1,dim=1,dir=fwd,nFace=1,GPU-device	32	1	6	1024	2	2	0	1	1	1	1	0.000253184	# 1789.15 Gflop/s, 1045.74 GB/s, tuning took 0.498339 seconds at Thu Jul  3 15:48:17 2025
     16x16x16x16	N4quda10CalculateYILb0EL19QudaFieldLocation_s2ENS_13CalculateYArgILb0EfsLi4ELi2ELi3ELi24ENS_5gauge10FieldOrderIfLi48ELi2EL21QudaGaugeFieldOrder_s2ELb1EsEENS4_IfLi48ELi2ELS5_2ELb1EiEENS4_IfLi3ELi1ELS5_2ELb1EfEENS_11colorspinor12FieldOrderCBIfLi4ELi3ELi24EL16QudaFieldOrder_s8EssLb0ELb0EEESC_SC_NS_6clover10FieldOrderIfLi3ELi4EL22QudaCloverFieldOrder_s4EEEEEEE	GPU-offline,vol=65536,parity=2,precision=2,order=8,Ns=4,Nc=72,nVec=24,comm=0000,computeUV,compute_max,tile_size=3x2x1,dim=2,dir=back,nFace=1,GPU-device	32	1	12	1024	2	1	16385	1	1	1	1	0.000240435	# 1884.02 Gflop/s, 1101.19 GB/s, tuning took 0.456874 seconds at Thu Jul  3 15:48:30 2025
     16x16x16x16	N4quda10CalculateYILb0EL19QudaFieldLocation_s2ENS_13CalculateYArgILb0EfsLi4ELi2ELi3ELi24ENS_5gauge10FieldOrderIfLi48ELi2EL21QudaGaugeFieldOrder_s2ELb1EsEENS4_IfLi48ELi2ELS5_2ELb1EiEENS4_IfLi3ELi1ELS5_2ELb1EfEENS_11colorspinor12FieldOrderCBIfLi4ELi3ELi24EL16QudaFieldOrder_s8EssLb0ELb0EEESC_SC_NS_6clover10FieldOrderIfLi3ELi4EL22QudaCloverFieldOrder_s4EEEEEEE	GPU-offline,vol=65536,parity=2,precision=2,order=8,Ns=4,Nc=72,nVec=24,comm=0000,computeUV,compute_max,tile_size=3x2x1,dim=2,dir=fwd,nFace=1,GPU-device	32	1	6	1024	2	2	0	1	1	1	1	0.000252672	# 1792.78 Gflop/s, 1047.86 GB/s, tuning took 0.491920 seconds at Thu Jul  3 15:48:19 2025
     16x16x16x16	N4quda10CalculateYILb0EL19QudaFieldLocation_s2ENS_13CalculateYArgILb0EfsLi4ELi2ELi3ELi24ENS_5gauge10FieldOrderIfLi48ELi2EL21QudaGaugeFieldOrder_s2ELb1EsEENS4_IfLi48ELi2ELS5_2ELb1EiEENS4_IfLi3ELi1ELS5_2ELb1EfEENS_11colorspinor12FieldOrderCBIfLi4ELi3ELi24EL16QudaFieldOrder_s8EssLb0ELb0EEESC_SC_NS_6clover10FieldOrderIfLi3ELi4EL22QudaCloverFieldOrder_s4EEEEEEE	GPU-offline,vol=65536,parity=2,precision=2,order=8,Ns=4,Nc=72,nVec=24,comm=0000,computeUV,compute_max,tile_size=3x2x1,dim=3,dir=back,nFace=1,GPU-device	32	1	12	1024	2	1	24577	1	1	1	1	0.000240454	# 1883.87 Gflop/s, 1101.10 GB/s, tuning took 0.458065 seconds at Thu Jul  3 15:48:33 2025
     16x16x16x16	N4quda10CalculateYILb0EL19QudaFieldLocation_s2ENS_13CalculateYArgILb0EfsLi4ELi2ELi3ELi24ENS_5gauge10FieldOrderIfLi48ELi2EL21QudaGaugeFieldOrder_s2ELb1EsEENS4_IfLi48ELi2ELS5_2ELb1EiEENS4_IfLi3ELi1ELS5_2ELb1EfEENS_11colorspinor12FieldOrderCBIfLi4ELi3ELi24EL16QudaFieldOrder_s8EssLb0ELb0EEESC_SC_NS_6clover10FieldOrderIfLi3ELi4EL22QudaCloverFieldOrder_s4EEEEEEE	GPU-offline,vol=65536,parity=2,precision=2,order=8,Ns=4,Nc=72,nVec=24,comm=0000,computeUV,compute_max,tile_size=3x2x1,dim=3,dir=fwd,nFace=1,GPU-device	32	1	6	1024	2	2	0	1	1	1	1	0.00025344	# 1787.35 Gflop/s, 1044.69 GB/s, tuning took 0.494015 seconds at Thu Jul  3 15:48:22 2025
     16x16x16x16	N4quda10CalculateYILb0EL19QudaFieldLocation_s2ENS_13CalculateYArgILb0EfsLi4ELi2ELi3ELi24ENS_5gauge10FieldOrderIfLi48ELi2EL21QudaGaugeFieldOrder_s2ELb1EsEENS4_IfLi48ELi2ELS5_2ELb1EiEENS4_IfLi3ELi1ELS5_2ELb1EfEENS_11colorspinor12FieldOrderCBIfLi4ELi3ELi24EL16QudaFieldOrder_s8EssLb0ELb0EEESC_SC_NS_6clover10FieldOrderIfLi3ELi4EL22QudaCloverFieldOrder_s4EEEEEEE	GPU-offline,vol=65536,parity=2,precision=2,order=8,Ns=4,Nc=72,nVec=24,comm=0000,computeUV,tile_size=3x2x1,dim=0,dir=back,nFace=1,GPU-device	32	1	12	1024	2	1	12289	1	1	1	1	0.000477867	# 947.93 Gflop/s, 395.52 GB/s, tuning took 0.754877 seconds at Thu Jul  3 15:48:26 2025
     16x16x16x16	N4quda10CalculateYILb0EL19QudaFieldLocation_s2ENS_13CalculateYArgILb0EfsLi4ELi2ELi3ELi24ENS_5gauge10FieldOrderIfLi48ELi2EL21QudaGaugeFieldOrder_s2ELb1EsEENS4_IfLi48ELi2ELS5_2ELb1EiEENS4_IfLi3ELi1ELS5_2ELb1EfEENS_11colorspinor12FieldOrderCBIfLi4ELi3ELi24EL16QudaFieldOrder_s8EssLb0ELb0EEESC_SC_NS_6clover10FieldOrderIfLi3ELi4EL22QudaCloverFieldOrder_s4EEEEEEE	GPU-offline,vol=65536,parity=2,precision=2,order=8,Ns=4,Nc=72,nVec=24,comm=0000,computeUV,tile_size=3x2x1,dim=0,dir=fwd,nFace=1,GPU-device	32	1	12	1024	2	1	24577	1	0	0	0	0.000476843	# 949.97 Gflop/s, 396.37 GB/s, tuning took 0.746723 seconds at Thu Jul  3 15:48:15 2025
     16x16x16x16	N4quda10CalculateYILb0EL19QudaFieldLocation_s2ENS_13CalculateYArgILb0EfsLi4ELi2ELi3ELi24ENS_5gauge10FieldOrderIfLi48ELi2EL21QudaGaugeFieldOrder_s2ELb1EsEENS4_IfLi48ELi2ELS5_2ELb1EiEENS4_IfLi3ELi1ELS5_2ELb1EfEENS_11colorspinor12FieldOrderCBIfLi4ELi3ELi24EL16QudaFieldOrder_s8EssLb0ELb0EEESC_SC_NS_6clover10FieldOrderIfLi3ELi4EL22QudaCloverFieldOrder_s4EEEEEEE	GPU-offline,vol=65536,parity=2,precision=2,order=8,Ns=4,Nc=72,nVec=24,comm=0000,computeUV,tile_size=3x2x1,dim=1,dir=back,nFace=1,GPU-device	32	1	12	1024	2	1	24577	1	1	1	1	0.000478208	# 947.25 Gflop/s, 395.24 GB/s, tuning took 0.760305 seconds at Thu Jul  3 15:48:28 2025
     16x16x16x16	N4quda10CalculateYILb0EL19QudaFieldLocation_s2ENS_13CalculateYArgILb0EfsLi4ELi2ELi3ELi24ENS_5gauge10FieldOrderIfLi48ELi2EL21QudaGaugeFieldOrder_s2ELb1EsEENS4_IfLi48ELi2ELS5_2ELb1EiEENS4_IfLi3ELi1ELS5_2ELb1EfEENS_11colorspinor12FieldOrderCBIfLi4ELi3ELi24EL16QudaFieldOrder_s8EssLb0ELb0EEESC_SC_NS_6clover10FieldOrderIfLi3ELi4EL22QudaCloverFieldOrder_s4EEEEEEE	GPU-offline,vol=65536,parity=2,precision=2,order=8,Ns=4,Nc=72,nVec=24,comm=0000,computeUV,tile_size=3x2x1,dim=1,dir=fwd,nFace=1,GPU-device	32	1	12	1024	2	1	12289	1	1	1	1	0.000477749	# 948.16 Gflop/s, 395.62 GB/s, tuning took 0.749332 seconds at Thu Jul  3 15:48:17 2025
     16x16x16x16	N4quda10CalculateYILb0EL19QudaFieldLocation_s2ENS_13CalculateYArgILb0EfsLi4ELi2ELi3ELi24ENS_5gauge10FieldOrderIfLi48ELi2EL21QudaGaugeFieldOrder_s2ELb1EsEENS4_IfLi48ELi2ELS5_2ELb1EiEENS4_IfLi3ELi1ELS5_2ELb1EfEENS_11colorspinor12FieldOrderCBIfLi4ELi3ELi24EL16QudaFieldOrder_s8EssLb0ELb0EEESC_SC_NS_6clover10FieldOrderIfLi3ELi4EL22QudaCloverFieldOrder_s4EEEEEEE	GPU-offline,vol=65536,parity=2,precision=2,order=8,Ns=4,Nc=72,nVec=24,comm=0000,computeUV,tile_size=3x2x1,dim=2,dir=back,nFace=1,GPU-device	32	1	12	1024	2	1	0	1	1	1	1	0.000477867	# 947.93 Gflop/s, 395.52 GB/s, tuning took 0.751939 seconds at Thu Jul  3 15:48:31 2025
     16x16x16x16	N4quda10CalculateYILb0EL19QudaFieldLocation_s2ENS_13CalculateYArgILb0EfsLi4ELi2ELi3ELi24ENS_5gauge10FieldOrderIfLi48ELi2EL21QudaGaugeFieldOrder_s2ELb1EsEENS4_IfLi48ELi2ELS5_2ELb1EiEENS4_IfLi3ELi1ELS5_2ELb1EfEENS_11colorspinor12FieldOrderCBIfLi4ELi3ELi24EL16QudaFieldOrder_s8EssLb0ELb0EEESC_SC_NS_6clover10FieldOrderIfLi3ELi4EL22QudaCloverFieldOrder_s4EEEEEEE	GPU-offline,vol=65536,parity=2,precision=2,order=8,Ns=4,Nc=72,nVec=24,comm=0000,computeUV,tile_size=3x2x1,dim=2,dir=fwd,nFace=1,GPU-device	32	1	12	1024	2	1	16385	1	1	1	1	0.000477525	# 948.61 Gflop/s, 395.80 GB/s, tuning took 0.745661 seconds at Thu Jul  3 15:48:20 2025
     16x16x16x16	N4quda10CalculateYILb0EL19QudaFieldLocation_s2ENS_13CalculateYArgILb0EfsLi4ELi2ELi3ELi24ENS_5gauge10FieldOrderIfLi48ELi2EL21QudaGaugeFieldOrder_s2ELb1EsEENS4_IfLi48ELi2ELS5_2ELb1EiEENS4_IfLi3ELi1ELS5_2ELb1EfEENS_11colorspinor12FieldOrderCBIfLi4ELi3ELi24EL16QudaFieldOrder_s8EssLb0ELb0EEESC_SC_NS_6clover10FieldOrderIfLi3ELi4EL22QudaCloverFieldOrder_s4EEEEEEE	GPU-offline,vol=65536,parity=2,precision=2,order=8,Ns=4,Nc=72,nVec=24,comm=0000,computeUV,tile_size=3x2x1,dim=3,dir=back,nFace=1,GPU-device	32	1	12	1024	2	1	12289	1	1	1	1	0.000477184	# 949.29 Gflop/s, 396.09 GB/s, tuning took 0.752601 seconds at Thu Jul  3 15:48:34 2025
     16x16x16x16	N4quda10CalculateYILb0EL19QudaFieldLocation_s2ENS_13CalculateYArgILb0EfsLi4ELi2ELi3ELi24ENS_5gauge10FieldOrderIfLi48ELi2EL21QudaGaugeFieldOrder_s2ELb1EsEENS4_IfLi48ELi2ELS5_2ELb1EiEENS4_IfLi3ELi1ELS5_2ELb1EfEENS_11colorspinor12FieldOrderCBIfLi4ELi3ELi24EL16QudaFieldOrder_s8EssLb0ELb0EEESC_SC_NS_6clover10FieldOrderIfLi3ELi4EL22QudaCloverFieldOrder_s4EEEEEEE	GPU-offline,vol=65536,parity=2,precision=2,order=8,Ns=4,Nc=72,nVec=24,comm=0000,computeUV,tile_size=3x2x1,dim=3,dir=fwd,nFace=1,GPU-device	32	1	12	1024	2	1	24577	1	1	1	1	0.000477589	# 948.48 Gflop/s, 395.75 GB/s, tuning took 0.747355 seconds at Thu Jul  3 15:48:23 2025
     16x16x16x16	N4quda10CalculateYILb0EL19QudaFieldLocation_s2ENS_13CalculateYArgILb0EfsLi4ELi2ELi3ELi24ENS_5gauge10FieldOrderIfLi48ELi2EL21QudaGaugeFieldOrder_s2ELb1EsEENS4_IfLi48ELi2ELS5_2ELb1EiEENS4_IfLi3ELi1ELS5_2ELb1EfEENS_11colorspinor12FieldOrderCBIfLi4ELi3ELi24EL16QudaFieldOrder_s8EssLb0ELb0EEESC_SC_NS_6clover10FieldOrderIfLi3ELi4EL22QudaCloverFieldOrder_s4EEEEEEE	GPU-offline,vol=65536,parity=2,precision=2,order=8,Ns=4,Nc=72,nVec=24,comm=0000,computeVUV,tile_size=4x2x1,dim=0,dir=back,nFace=1,bidirectional,GPU-device,coarse_vol=2x2x4x4	512	1	1	64	2	4	16385	1	1	1	0	0.0090665	# 799.40 Gflop/s, 401.61 GB/s, tuning took 1.519469 seconds at Thu Jul  3 15:48:27 2025
     16x16x16x16	N4quda10CalculateYILb0EL19QudaFieldLocation_s2ENS_13CalculateYArgILb0EfsLi4ELi2ELi3ELi24ENS_5gauge10FieldOrderIfLi48ELi2EL21QudaGaugeFieldOrder_s2ELb1EsEENS4_IfLi48ELi2ELS5_2ELb1EiEENS4_IfLi3ELi1ELS5_2ELb1EfEENS_11colorspinor12FieldOrderCBIfLi4ELi3ELi24EL16QudaFieldOrder_s8EssLb0ELb0EEESC_SC_NS_6clover10FieldOrderIfLi3ELi4EL22QudaCloverFieldOrder_s4EEEEEEE	GPU-offline,vol=65536,parity=2,precision=2,order=8,Ns=4,Nc=72,nVec=24,comm=0000,computeVUV,tile_size=4x2x1,dim=0,dir=fwd,nFace=1,bidirectional,GPU-device,coarse_vol=2x2x4x4	512	1	1	64	2	4	16385	1	1	1	0	0.00909619	# 796.79 Gflop/s, 400.30 GB/s, tuning took 1.482261 seconds at Thu Jul  3 15:48:16 2025
     16x16x16x16	N4quda10CalculateYILb0EL19QudaFieldLocation_s2ENS_13CalculateYArgILb0EfsLi4ELi2ELi3ELi24ENS_5gauge10FieldOrderIfLi48ELi2EL21QudaGaugeFieldOrder_s2ELb1EsEENS4_IfLi48ELi2ELS5_2ELb1EiEENS4_IfLi3ELi1ELS5_2ELb1EfEENS_11colorspinor12FieldOrderCBIfLi4ELi3ELi24EL16QudaFieldOrder_s8EssLb0ELb0EEESC_SC_NS_6clover10FieldOrderIfLi3ELi4EL22QudaCloverFieldOrder_s4EEEEEEE	GPU-offline,vol=65536,parity=2,precision=2,order=8,Ns=4,Nc=72,nVec=24,comm=0000,computeVUV,tile_size=4x2x1,dim=1,dir=back,nFace=1,bidirectional,GPU-device,coarse_vol=2x2x4x4	512	1	1	64	2	4	16385	1	1	1	0	0.00916343	# 790.94 Gflop/s, 397.36 GB/s, tuning took 1.524734 seconds at Thu Jul  3 15:48:30 2025
     16x16x16x16	N4quda10CalculateYILb0EL19QudaFieldLocation_s2ENS_13CalculateYArgILb0EfsLi4ELi2ELi3ELi24ENS_5gauge10FieldOrderIfLi48ELi2EL21QudaGaugeFieldOrder_s2ELb1EsEENS4_IfLi48ELi2ELS5_2ELb1EiEENS4_IfLi3ELi1ELS5_2ELb1EfEENS_11colorspinor12FieldOrderCBIfLi4ELi3ELi24EL16QudaFieldOrder_s8EssLb0ELb0EEESC_SC_NS_6clover10FieldOrderIfLi3ELi4EL22QudaCloverFieldOrder_s4EEEEEEE	GPU-offline,vol=65536,parity=2,precision=2,order=8,Ns=4,Nc=72,nVec=24,comm=0000,computeVUV,tile_size=4x2x1,dim=1,dir=fwd,nFace=1,bidirectional,GPU-device,coarse_vol=2x2x4x4	512	1	1	64	2	4	24577	1	1	1	0	0.00904124	# 801.63 Gflop/s, 402.73 GB/s, tuning took 1.476756 seconds at Thu Jul  3 15:48:19 2025
     16x16x16x16	N4quda10CalculateYILb0EL19QudaFieldLocation_s2ENS_13CalculateYArgILb0EfsLi4ELi2ELi3ELi24ENS_5gauge10FieldOrderIfLi48ELi2EL21QudaGaugeFieldOrder_s2ELb1EsEENS4_IfLi48ELi2ELS5_2ELb1EiEENS4_IfLi3ELi1ELS5_2ELb1EfEENS_11colorspinor12FieldOrderCBIfLi4ELi3ELi24EL16QudaFieldOrder_s8EssLb0ELb0EEESC_SC_NS_6clover10FieldOrderIfLi3ELi4EL22QudaCloverFieldOrder_s4EEEEEEE	GPU-offline,vol=65536,parity=2,precision=2,order=8,Ns=4,Nc=72,nVec=24,comm=0000,computeVUV,tile_size=4x2x1,dim=2,dir=back,nFace=1,bidirectional,GPU-device,coarse_vol=2x2x4x4	512	1	1	64	2	4	24577	1	1	1	0	0.00862686	# 840.14 Gflop/s, 422.07 GB/s, tuning took 1.517092 seconds at Thu Jul  3 15:48:33 2025
     16x16x16x16	N4quda10CalculateYILb0EL19QudaFieldLocation_s2ENS_13CalculateYArgILb0EfsLi4ELi2ELi3ELi24ENS_5gauge10FieldOrderIfLi48ELi2EL21QudaGaugeFieldOrder_s2ELb1EsEENS4_IfLi48ELi2ELS5_2ELb1EiEENS4_IfLi3ELi1ELS5_2ELb1EfEENS_11colorspinor12FieldOrderCBIfLi4ELi3ELi24EL16QudaFieldOrder_s8EssLb0ELb0EEESC_SC_NS_6clover10FieldOrderIfLi3ELi4EL22QudaCloverFieldOrder_s4EEEEEEE	GPU-offline,vol=65536,parity=2,precision=2,order=8,Ns=4,Nc=72,nVec=24,comm=0000,computeVUV,tile_size=4x2x1,dim=2,dir=fwd,nFace=1,bidirectional,GPU-device,coarse_vol=2x2x4x4	512	1	1	64	2	4	16385	1	1	1	0	0.00926652	# 782.14 Gflop/s, 392.94 GB/s, tuning took 1.504650 seconds at Thu Jul  3 15:48:22 2025
     16x16x16x16	N4quda10CalculateYILb0EL19QudaFieldLocation_s2ENS_13CalculateYArgILb0EfsLi4ELi2ELi3ELi24ENS_5gauge10FieldOrderIfLi48ELi2EL21QudaGaugeFieldOrder_s2ELb1EsEENS4_IfLi48ELi2ELS5_2ELb1EiEENS4_IfLi3ELi1ELS5_2ELb1EfEENS_11colorspinor12FieldOrderCBIfLi4ELi3ELi24EL16QudaFieldOrder_s8EssLb0ELb0EEESC_SC_NS_6clover10FieldOrderIfLi3ELi4EL22QudaCloverFieldOrder_s4EEEEEEE	GPU-offline,vol=65536,parity=2,precision=2,order=8,Ns=4,Nc=72,nVec=24,comm=0000,computeVUV,tile_size=4x2x1,dim=3,dir=back,nFace=1,bidirectional,GPU-device,coarse_vol=2x2x4x4	512	1	1	64	2	4	16385	1	1	1	0	0.00924535	# 783.93 Gflop/s, 393.84 GB/s, tuning took 1.551476 seconds at Thu Jul  3 15:48:35 2025
     16x16x16x16	N4quda10CalculateYILb0EL19QudaFieldLocation_s2ENS_13CalculateYArgILb0EfsLi4ELi2ELi3ELi24ENS_5gauge10FieldOrderIfLi48ELi2EL21QudaGaugeFieldOrder_s2ELb1EsEENS4_IfLi48ELi2ELS5_2ELb1EiEENS4_IfLi3ELi1ELS5_2ELb1EfEENS_11colorspinor12FieldOrderCBIfLi4ELi3ELi24EL16QudaFieldOrder_s8EssLb0ELb0EEESC_SC_NS_6clover10FieldOrderIfLi3ELi4EL22QudaCloverFieldOrder_s4EEEEEEE	GPU-offline,vol=65536,parity=2,precision=2,order=8,Ns=4,Nc=72,nVec=24,comm=0000,computeVUV,tile_size=4x2x1,dim=3,dir=fwd,nFace=1,bidirectional,GPU-device,coarse_vol=2x2x4x4	512	1	1	64	2	4	16384	1	1	1	0	0.00922994	# 785.24 Gflop/s, 394.50 GB/s, tuning took 1.517309 seconds at Thu Jul  3 15:48:24 2025
     16x16x16x16	N4quda10CopyCloverINS_6clover11FloatNOrderIfLi72ELi4ELb0ELb1ELb0EEENS2_IdLi72ELi2ELb0ELb1ELb0EEEfdEE	GPU-offline,vol=65536precision=8Nc=3	32	2	1	1024	1	1	3781	-1	-1	-1	-1	0.000135168	# 0.00 Gflop/s, 325.82 GB/s, tuning took 0.093050 seconds at Thu Jul  3 15:47:32 2025
     16x16x16x16	N4quda10CopyCloverINS_6clover11FloatNOrderIsLi72ELi8ELb0ELb1ELb0EEENS2_IdLi72ELi2ELb0ELb1ELb0EEEsdEE	GPU-offline,vol=65536precision=8Nc=3	32	2	1	1024	1	1	3781	-1	-1	-1	-1	0.000114347	# 0.00 Gflop/s, 320.96 GB/s, tuning took 0.077867 seconds at Thu Jul  3 15:47:32 2025
     16x16x16x16	N4quda10ProjectSU3IdLi3EL21QudaReconstructType_s18EEE	GPU-offline,vol=65536,stride=32768,precision=8,geometry=4,Nc=3	64	1	1	512	2	4	3781	-1	-1	-1	-1	0.00223539	# 0.00 Gflop/s, 33.77 GB/s, tuning took 2.663819 seconds at Thu Jul  3 15:45:21 2025
     16x16x16x16	N4quda11CopyGaugeExIddLi18ENS_5gauge11FloatNOrderIdLi18ELi2ELi12EL20QudaStaggeredPhase_s0ELb1EL19QudaGhostExchange_sn2147483648ELb0EEES5_EE	GPU-offline,vol=65536,stride=34816,precision=8,geometry=4,Nc=3vol=65536,stride=32768,precision=8,geometry=4,Nc=3,r=0000	448	1	1	74	2	1	0	-1	-1	-1	-1	0.000154478	# 0.00 Gflop/s, 336.00 GB/s, tuning took 0.083971 seconds at Thu Jul  3 15:47:09 2025
     16x16x16x16	N4quda11SpinorNoiseIfLi4ELi3EEE	GPU-offline,vol=65536,parity=2,precision=4,order=4,Ns=4,Nc=3,uniform	96	1	1	342	2	1	0	-1	-1	-1	-1	7.03147e-05	# 0.00 Gflop/s, 89.48 GB/s, tuning took 0.072789 seconds at Thu Jul  3 15:47:36 2025
     16x16x16x16	N4quda12CloverInvertIdEE	GPU-offline,vol=65536precision=8Nc=3,trlog,twist=false	32	2	1	56	1	1	0	-1	-1	-1	-1	0.000649557	# 0.00 Gflop/s, 45.20 GB/s, tuning took 16.620051 seconds at Thu Jul  3 15:47:31 2025
     16x16x16x16	N4quda12ExtractGhostIdLi3ENS_5gauge11FloatNOrderIdLi18ELi2ELi12EL20QudaStaggeredPhase_s0ELb1EL19QudaGhostExchange_sn2147483648ELb0EEEEE	GPU-offline,vol=65536,stride=34816,precision=8,geometry=4,Nc=3,extract	64	1	1	64	1	8	0	-1	-1	-1	-1	1.24878e-05	# 0.00 Gflop/s, 251.90 GB/s, tuning took 0.031502 seconds at Thu Jul  3 15:47:08 2025
     16x16x16x16	N4quda12WilsonCloverINS_15WilsonCloverArgIfLi3ELi4EL21QudaReconstructType_s12ELb0ELb0EEEEE	policy,GPU-offline,vol=65536,parity=2,precision=4,order=4,Ns=4,Nc=3,commDim=0000,xpay,dagger,n_rhs=1,n_rhs_tile=1,topo=1111,p2p=0,gdr=0,nvshmem=0,pol=110000000000000000	32	1	1	1	1	1	0	0	0	0	-1	0.000156087	# 806.15 Gflop/s, 577.74 GB/s, tuning took 0.003796 seconds at Thu Jul  3 15:48:54 2025
     16x16x16x16	N4quda12WilsonCloverINS_15WilsonCloverArgIfLi3ELi4EL21QudaReconstructType_s12ELb0ELb0EEEEE	policy,GPU-offline,vol=65536,parity=2,precision=4,order=4,Ns=4,Nc=3,commDim=0000,xpay,n_rhs=1,n_rhs_tile=1,topo=1111,p2p=0,gdr=0,nvshmem=0,pol=110000000000000000	32	1	1	1	1	1	0	0	0	0	-1	0.000159598	# 788.41 Gflop/s, 565.03 GB/s, tuning took 0.003882 seconds at Thu Jul  3 15:48:54 2025
     16x16x16x16	N4quda12WilsonCloverINS_15WilsonCloverArgIfLi3ELi4EL21QudaReconstructType_s12ELb0ELb0EEEEE	policy_kernel=interior,GPU-offline,vol=65536,parity=2,precision=4,order=4,Ns=4,Nc=3,commDim=0000,xpay,dagger,n_rhs=1,n_rhs_tile=1,comm=0000	64	1	2	512	1	1	33793	-1	-1	-1	-1	0.000155941	# 806.90 Gflop/s, 578.28 GB/s, tuning took 0.272629 seconds at Thu Jul  3 15:48:54 2025
     16x16x16x16	N4quda12WilsonCloverINS_15WilsonCloverArgIfLi3ELi4EL21QudaReconstructType_s12ELb0ELb0EEEEE	policy_kernel=interior,GPU-offline,vol=65536,parity=2,precision=4,order=4,Ns=4,Nc=3,commDim=0000,xpay,n_rhs=1,n_rhs_tile=1,comm=0000	64	1	2	512	1	1	33793	-1	-1	-1	-1	0.000155502	# 809.18 Gflop/s, 579.91 GB/s, tuning took 0.332056 seconds at Thu Jul  3 15:48:54 2025
     16x16x16x16	N4quda13ComputeCloverIdEE	GPU-offline,vol=65536precision=8Nc=3	64	2	1	512	1	1	0	-1	-1	-1	-1	0.000252368	# 124.65 Gflop/s, 340.71 GB/s, tuning took 0.030927 seconds at Thu Jul  3 15:47:15 2025
     16x16x16x16	N4quda15CopyColorSpinorILi4ELi3ENS_11colorspinor11FloatNOrderIdLi4ELi3ELi2ELb0ELb0ELb0EEENS1_21SpaceSpinorColorOrderIdLi4ELi3EEESt5tupleIJRNS_16ColorSpinorFieldERKS7_19QudaFieldLocation_sPdPKdEEEE	GPU-offline,vol=65536,parity=2,precision=8,order=9,Ns=4,Nc=3vol=65536,parity=2,precision=8,order=2,Ns=4,Nc=3to_ukqcd,from_degrand_rossi	32	1	1	1024	2	1	0	-1	-1	-1	-1	7.79717e-05	# 0.00 Gflop/s, 322.76 GB/s, tuning took 0.035582 seconds at Thu Jul  3 15:48:56 2025
     16x16x16x16	N4quda15CopyColorSpinorILi4ELi3ENS_11colorspinor11FloatNOrderIfLi4ELi3ELi4ELb0ELb0ELb0EEENS2_IsLi4ELi3ELi8ELb0ELb0ELb0EEESt5tupleIJRNS_16ColorSpinorFieldERKS6_19QudaFieldLocation_sPfPKsEEEE	GPU-offline,vol=65536,parity=2,precision=2,order=8,Ns=4,Nc=3vol=65536,parity=2,precision=4,order=4,Ns=4,Nc=3to_ukqcd,from_degrand_rossi	288	1	1	114	2	1	0	-1	-1	-1	-1	3.08111e-05	# 0.00 Gflop/s, 314.80 GB/s, tuning took 0.019295 seconds at Thu Jul  3 15:47:36 2025
     16x16x16x16	N4quda15CopyColorSpinorILi4ELi3ENS_11colorspinor11FloatNOrderIsLi4ELi3ELi8ELb0ELb0ELb0EEENS2_IfLi4ELi3ELi4ELb0ELb0ELb0EEESt5tupleIJRNS_16ColorSpinorFieldERKS6_19QudaFieldLocation_sPsPKfEEEE	GPU-offline,vol=65536,parity=2,precision=4,order=4,Ns=4,Nc=3vol=65536,parity=2,precision=2,order=8,Ns=4,Nc=3	416	2	1	79	1	1	0	-1	-1	-1	-1	3.10303e-05	# 0.00 Gflop/s, 312.58 GB/s, tuning took 0.019255 seconds at Thu Jul  3 15:47:36 2025
     16x16x16x16	N4quda15CopyColorSpinorILi4ELi3ENS_11colorspinor11FloatNOrderIsLi4ELi3ELi8ELb0ELb0ELb0EEENS2_IfLi4ELi3ELi4ELb0ELb0ELb0EEESt5tupleIJRNS_16ColorSpinorFieldERKS6_19QudaFieldLocation_sPsPKfEEEE	GPU-offline,vol=65536,parity=2,precision=4,order=4,Ns=4,Nc=3vol=65536,parity=2,precision=2,order=8,Ns=4,Nc=3to_degrand_rossi,from_ukqcd	288	2	1	114	1	1	0	-1	-1	-1	-1	3.11855e-05	# 0.00 Gflop/s, 311.02 GB/s, tuning took 0.016027 seconds at Thu Jul  3 15:47:39 2025
     16x16x16x16	N4quda15CopyColorSpinorILi4ELi3ENS_11colorspinor21SpaceSpinorColorOrderIdLi4ELi3EEENS1_11FloatNOrderIdLi4ELi3ELi2ELb0ELb0ELb0EEESt5tupleIJRNS_16ColorSpinorFieldERKS7_19QudaFieldLocation_sPdPKdEEEE	GPU-offline,vol=65536,parity=2,precision=8,order=2,Ns=4,Nc=3vol=65536,parity=2,precision=8,order=9,Ns=4,Nc=3to_degrand_rossi,from_ukqcd	128	2	1	256	1	1	0	-1	-1	-1	-1	7.75877e-05	# 0.00 Gflop/s, 324.35 GB/s, tuning took 0.022468 seconds at Thu Jul  3 15:49:44 2025
     16x16x16x16	N4quda4blas10caxpyNorm2IdfEE	GPU-offline,vol=65536,parity=2,precision=2,order=8,Ns=4,Nc=3,vol=65536,parity=2,precision=4,order=4,Ns=4,Nc=3,n_rhs=24	512	1	1	56	1	24	0	-1	-1	-1	-1	0.00116122	# 260.06 Gflop/s, 330.50 GB/s, tuning took 1.073916 seconds at Thu Jul  3 15:48:52 2025
     16x16x16x16	N4quda4blas12MaxDeviationIdfEE	GPU-offline,vol=65536,parity=2,precision=2,order=8,Ns=4,Nc=3,vol=65536,parity=2,precision=4,order=4,Ns=4,Nc=3,n_rhs=24	32	1	1	42	1	24	0	-1	-1	-1	-1	0.00120041	# 0.00 Gflop/s, 193.92 GB/s, tuning took 1.336627 seconds at Thu Jul  3 15:48:51 2025
     16x16x16x16	N4quda4blas4CdotIdfEE	GPU-offline,vol=65536,parity=2,precision=2,order=8,Ns=4,Nc=3,n_rhs=1	64	1	1	56	1	1	0	-1	-1	-1	-1	7.60183e-05	# 82.76 Gflop/s, 89.66 GB/s, tuning took 0.228895 seconds at Thu Jul  3 15:47:40 2025
     16x16x16x16	N4quda4blas4CdotIdfEE	GPU-offline,vol=65536,parity=2,precision=4,order=4,Ns=4,Nc=3,n_rhs=1	256	1	1	28	1	1	0	-1	-1	-1	-1	7.53371e-05	# 83.51 Gflop/s, 167.02 GB/s, tuning took 0.271153 seconds at Thu Jul  3 15:48:54 2025
     16x16x16x16	N4quda4blas4axy_IdEE	GPU-offline,vol=65536,parity=2,precision=8,order=2,Ns=4,Nc=3,n_rhs=1	1024	1	1	56	1	2	0	-1	-1	-1	-1	7.83902e-05	# 60.19 Gflop/s, 321.03 GB/s, tuning took 0.023412 seconds at Thu Jul  3 15:48:56 2025
     16x16x16x16	N4quda4blas4axy_IfEE	GPU-offline,vol=65536,parity=2,precision=2,order=8,Ns=4,Nc=3,n_rhs=1	288	1	2	56	1	1	0	-1	-1	-1	-1	2.20046e-05	# 214.44 Gflop/s, 309.74 GB/s, tuning took 0.014083 seconds at Thu Jul  3 15:47:40 2025
     16x16x16x16	N4quda4blas5Norm2IddEE	GPU-offline,vol=65536,parity=2,precision=8,order=2,Ns=4,Nc=3,n_rhs=1	256	1	1	56	1	1	0	-1	-1	-1	-1	4.6256e-05	# 68.01 Gflop/s, 272.03 GB/s, tuning took 0.266612 seconds at Thu Jul  3 15:48:56 2025
     16x16x16x16	N4quda4blas5Norm2IdfEE	GPU-offline,vol=65536,parity=2,precision=2,order=8,Ns=4,Nc=3,n_rhs=1	128	1	1	56	1	1	0	-1	-1	-1	-1	4.34031e-05	# 72.48 Gflop/s, 78.52 GB/s, tuning took 0.134138 seconds at Thu Jul  3 15:47:40 2025
     16x16x16x16	N4quda4blas5Norm2IdfEE	GPU-offline,vol=65536,parity=2,precision=2,order=8,Ns=4,Nc=3,n_rhs=24	32	1	1	42	1	24	0	-1	-1	-1	-1	0.000792576	# 95.26 Gflop/s, 103.19 GB/s, tuning took 0.889400 seconds at Thu Jul  3 15:48:37 2025
     16x16x16x16	N4quda4blas6caxpy_IfEE	GPU-offline,vol=65536,parity=2,precision=2,order=8,Ns=4,Nc=3,n_rhs=1	800	1	1	56	1	2	0	-1	-1	-1	-1	3.27566e-05	# 192.07 Gflop/s, 312.11 GB/s, tuning took 0.016018 seconds at Thu Jul  3 15:47:40 2025
     16x16x16x16	N4quda5FmunuIdLi3EL21QudaReconstructType_s12EEE	GPU-offline,vol=65536,stride=32768,precision=8,geometry=4,Nc=3,r=0000,comm=0000	64	1	1	512	2	6	3277	-1	-1	-1	-1	0.00711407	# 136.30 Gflop/s, 92.86 GB/s, tuning took 6.162786 seconds at Thu Jul  3 15:47:15 2025
     16x16x16x16	N4quda7RNGInitE	GPU-offline,vol=65536,parity=2,precision=2,order=8,Ns=4,Nc=3	32	1	1	1024	2	1	0	-1	-1	-1	-1	0.0273312	# 0.00 Gflop/s, 0.00 GB/s, tuning took 3.766039 seconds at Thu Jul  3 15:47:36 2025
     16x16x16x16	N4quda9CopyGaugeINS_12CopyGaugeArgIddLi18ELb0ENS_5gauge11FloatNOrderIdLi18ELi2ELi12EL20QudaStaggeredPhase_s0ELb1EL19QudaGhostExchange_sn2147483648ELb0EEENS2_8QDPOrderIdLi18EEEEEEE	GPU-offline,vol=65536,stride=32768,precision=8,geometry=4,Nc=3,vol=65536,stride=34816,precision=8,geometry=4,Nc=3	448	1	2	74	1	4	0	-1	-1	-1	-1	0.000190464	# 0.00 Gflop/s, 338.58 GB/s, tuning took 0.063358 seconds at Thu Jul  3 15:47:08 2025
     16x16x16x16	N4quda9CopyGaugeINS_12CopyGaugeArgIddLi18ELb0ENS_5gauge11FloatNOrderIdLi18ELi2ELi12EL20QudaStaggeredPhase_s0ELb1EL19QudaGhostExchange_sn2147483648ELb0EEES6_EEEE	GPU-offline,vol=65536,stride=34816,precision=8,geometry=4,Nc=3,vol=65536,stride=34816,precision=8,geometry=4,Nc=3,ghost	160	1	4	13	1	2	0	-1	-1	-1	-1	7.84234e-06	# 0.00 Gflop/s, 426.19 GB/s, tuning took 0.012797 seconds at Thu Jul  3 15:47:08 2025
     16x16x16x16	N4quda9CopyGaugeINS_12CopyGaugeArgIddLi18ELb0ENS_5gauge11FloatNOrderIdLi18ELi2ELi18EL20QudaStaggeredPhase_s0ELb1EL19QudaGhostExchange_sn2147483648ELb0EEENS2_8QDPOrderIdLi18EEEEEEE	GPU-offline,vol=65536,stride=32768,precision=8,geometry=4,Nc=3,vol=65536,stride=32768,precision=8,geometry=4,Nc=3	256	1	3	128	1	3	0	-1	-1	-1	-1	0.000229158	# 0.00 Gflop/s, 329.46 GB/s, tuning took 0.119285 seconds at Thu Jul  3 15:45:18 2025
     16x16x16x16	N4quda9CopyGaugeINS_12CopyGaugeArgIddLi18ELb0ENS_5gauge8QDPOrderIdLi18EEENS2_11FloatNOrderIdLi18ELi2ELi18EL20QudaStaggeredPhase_s0ELb1EL19QudaGhostExchange_sn2147483648ELb0EEEEEEE	GPU-offline,vol=65536,stride=32768,precision=8,geometry=4,Nc=3,vol=65536,stride=32768,precision=8,geometry=4,Nc=3	32	1	7	1024	1	2	0	-1	-1	-1	-1	0.000228966	# 0.00 Gflop/s, 329.73 GB/s, tuning took 0.073957 seconds at Thu Jul  3 15:45:21 2025
     16x16x16x16	N4quda9CopyGaugeINS_12CopyGaugeArgIfdLi18ELb0ENS_5gauge11FloatNOrderIfLi18ELi4ELi12EL20QudaStaggeredPhase_s0ELb1EL19QudaGhostExchange_sn2147483648ELb0EEENS3_IdLi18ELi2ELi12ELS4_0ELb1ELS5_n2147483648ELb0EEEEEEE	GPU-offline,vol=65536,stride=34816,precision=8,geometry=4,Nc=3,vol=65536,stride=34816,precision=4,geometry=4,Nc=3	32	1	1	1024	1	8	0	-1	-1	-1	-1	0.000115371	# 0.00 Gflop/s, 347.64 GB/s, tuning took 0.042355 seconds at Thu Jul  3 15:47:09 2025
     16x16x16x16	N4quda9CopyGaugeINS_12CopyGaugeArgIfdLi18ELb0ENS_5gauge11FloatNOrderIfLi18ELi4ELi12EL20QudaStaggeredPhase_s0ELb1EL19QudaGhostExchange_sn2147483648ELb0EEENS3_IdLi18ELi2ELi12ELS4_0ELb1ELS5_n2147483648ELb0EEEEEEE	GPU-offline,vol=65536,stride=34816,precision=8,geometry=4,Nc=3,vol=65536,stride=34816,precision=4,geometry=4,Nc=3,ghost	32	1	2	64	1	4	0	-1	-1	-1	-1	6.72091e-06	# 0.00 Gflop/s, 372.98 GB/s, tuning took 0.012751 seconds at Thu Jul  3 15:47:09 2025
     16x16x16x16	N4quda9CopyGaugeINS_12CopyGaugeArgIffLi18ELb0ENS_5gauge11FloatNOrderIfLi18ELi2ELi18EL20QudaStaggeredPhase_s0ELb1EL19QudaGhostExchange_sn2147483648ELb0EEENS3_IfLi18ELi4ELi12ELS4_0ELb1ELS5_n2147483648ELb0EEEEEEE	GPU-offline,vol=65536,stride=34816,precision=4,geometry=4,Nc=3,vol=65536,stride=34816,precision=4,geometry=4,Nc=3	672	1	1	49	1	8	0	-1	-1	-1	-1	9.70938e-05	# 0.00 Gflop/s, 344.24 GB/s, tuning took 0.073731 seconds at Thu Jul  3 15:47:43 2025
     16x16x16x16	N4quda9CopyGaugeINS_12CopyGaugeArgIffLi18ELb0ENS_5gauge11FloatNOrderIfLi18ELi2ELi18EL20QudaStaggeredPhase_s0ELb1EL19QudaGhostExchange_sn2147483648ELb0EEENS3_IfLi18ELi4ELi12ELS4_0ELb1ELS5_n2147483648ELb0EEEEEEE	GPU-offline,vol=65536,stride=34816,precision=4,geometry=4,Nc=3,vol=65536,stride=34816,precision=4,geometry=4,Nc=3,ghost	96	1	3	22	1	3	0	-1	-1	-1	-1	3.86338e-06	# 0.00 Gflop/s, 540.71 GB/s, tuning took 0.011573 seconds at Thu Jul  3 15:47:43 2025
     16x16x16x16	N4quda9CopyGaugeINS_12CopyGaugeArgIsdLi18ELb0ENS_5gauge11FloatNOrderIsLi18ELi4ELi12EL20QudaStaggeredPhase_s0ELb1EL19QudaGhostExchange_sn2147483648ELb0EEENS3_IdLi18ELi2ELi12ELS4_0ELb1ELS5_n2147483648ELb0EEEEEEE	GPU-offline,vol=65536,stride=34816,precision=8,geometry=4,Nc=3,vol=65536,stride=34816,precision=2,geometry=4,Nc=3	32	1	7	1024	1	2	0	-1	-1	-1	-1	9.728e-05	# 0.00 Gflop/s, 343.58 GB/s, tuning took 0.037841 seconds at Thu Jul  3 15:47:09 2025
     16x16x16x16	N4quda9CopyGaugeINS_12CopyGaugeArgIsdLi18ELb0ENS_5gauge11FloatNOrderIsLi18ELi4ELi12EL20QudaStaggeredPhase_s0ELb1EL19QudaGhostExchange_sn2147483648ELb0EEENS3_IdLi18ELi2ELi12ELS4_0ELb1ELS5_n2147483648ELb0EEEEEEE	GPU-offline,vol=65536,stride=34816,precision=8,geometry=4,Nc=3,vol=65536,stride=34816,precision=2,geometry=4,Nc=3,ghost	64	1	1	32	1	8	0	-1	-1	-1	-1	6.36101e-06	# 0.00 Gflop/s, 328.40 GB/s, tuning took 0.012583 seconds at Thu Jul  3 15:47:09 2025
16x16x16x16,2x2x4x4	N4quda14RestrictLaunchIffsLi4ELi3ELi2ELi24EEE	GPU-offline,vol=65536,parity=2,precision=4,order=4,Ns=4,Nc=3,vol=64,parity=2,precision=4,order=2,Ns=2,Nc=24,n_rhs=1,from_non_rel	64	1	6	64	1	1	0	8	-1	-1	-1	0.000261632	# 577.13 Gflop/s, 314.71 GB/s, tuning took 0.289985 seconds at Thu Jul  3 15:48:53 2025
16x16x16x16,2x2x4x4	N4quda14RestrictLaunchIfssLi4ELi3ELi2ELi24EEE	GPU-offline,vol=65536,parity=2,precision=2,order=8,Ns=4,Nc=3,vol=64,parity=2,precision=4,order=2,Ns=2,Nc=24,n_rhs=24	32	1	4	64	1	36	0	2	-1	-1	-1	0.00311668	# 1162.74 Gflop/s, 611.84 GB/s, tuning took 0.312861 seconds at Thu Jul  3 15:48:38 2025
         1835008	N4quda15TransformReduceINS_7maximumIdEEKNS_7complexIdEEmNS_8abs_max_IddEENS_8identityEEE	,batch_size=1	512	1	1	54	1	1	0	-1	-1	-1	-1	9.72887e-05	# 0.00 Gflop/s, 301.78 GB/s, tuning took 0.657670 seconds at Thu Jul  3 15:47:32 2025
         1x2x4x4	N4quda10CopySpinorIffLi2ELi24ENS_11colorspinor12FieldOrderCBIfLi2ELi24ELi1EL16QudaFieldOrder_s2EffLb0ELb0EEES4_EE	GPU-offline,vol=32,parity=1,precision=4,order=2,Ns=2,Nc=24	512	1	1	1	2	24	0	-1	-1	-1	-1	1.82256e-06	# 0.00 Gflop/s, 13.48 GB/s, tuning took 0.013938 seconds at Thu Jul  3 15:48:57 2025
         1x2x4x4	N4quda12DslashCoarseIfssLi2ELi24ELb0ELb1ELb0ELNS_10DslashTypeE2EEE	policy_kernel,GPU-offline,vol=32,parity=1,precision=4,order=2,Ns=2,Nc=24,comm=0000,full,halo=00000000,n_rhs=1	128	1	4	2	1	12	16385	8	1	1	1	2.59769e-06	# 225.87 Gflop/s, 122.99 GB/s, tuning took 0.026624 seconds at Thu Jul  3 15:48:53 2025
         1x2x4x4	N4quda12DslashCoarseIfssLi2ELi24ELb1ELb0ELb0ELNS_10DslashTypeE2EEE	policy_kernel,GPU-offline,vol=32,parity=1,precision=4,order=2,Ns=2,Nc=24,comm=0000,full,halo=00000000,n_rhs=1	64	1	8	1	1	48	4096	2	4	1	1	8.01336e-06	# 588.46 Gflop/s, 308.22 GB/s, tuning took 0.058491 seconds at Thu Jul  3 15:48:53 2025
         1x2x4x4	N4quda22DslashCoarsePolicyTuneINS_18DslashCoarseLaunchINS_1DELb0ELi24ELb0ELi1EEEEE	policy,clover,vol=32,parity=1,precision=4,order=2,Ns=2,Nc=24,gauge_prec=2,halo_prec=2,comm=0000,topo=1111,p2p=0,gdr=0,nvshmem=0,pol=11110000000,full,n_rhs=1	32	1	1	1	1	1	0	3	0	0	0	2.98057e-06	# 196.86 Gflop/s, 107.19 GB/s, tuning took 0.003490 seconds at Thu Jul  3 15:48:53 2025
         1x2x4x4	N4quda22DslashCoarsePolicyTuneINS_18DslashCoarseLaunchINS_1DELb0ELi24ELb0ELi1EEEEE	policy,dslash,vol=32,parity=1,precision=4,order=2,Ns=2,Nc=24,gauge_prec=2,halo_prec=2,comm=0000,topo=1111,p2p=0,gdr=0,nvshmem=0,pol=11110000000,full,n_rhs=1	32	1	1	1	1	1	0	0	0	0	0	7.99219e-06	# 590.02 Gflop/s, 309.04 GB/s, tuning took 0.004181 seconds at Thu Jul  3 15:48:53 2025
         1x2x4x4	N4quda4blas10caxpyNorm2IdfEE	GPU-offline,vol=32,parity=1,precision=4,order=2,Ns=2,Nc=24,n_rhs=1	256	1	1	1	1	1	0	-1	-1	-1	-1	8.36925e-06	# 2.94 Gflop/s, 4.40 GB/s, tuning took 0.006891 seconds at Thu Jul  3 15:48:53 2025
         1x2x4x4	N4quda4blas11multicaxpy_IfEE	GPU-offline,vol=32,parity=1,precision=4,order=2,Ns=2,Nc=24,Nxz=4,Nyw=1	640	1	1	56	1	1	0	1	0	0	0	4.60225e-06	# 10.68 Gflop/s, 16.02 GB/s, tuning took 0.009325 seconds at Thu Jul  3 15:48:57 2025
         1x2x4x4	N4quda4blas12MaxDeviationIdfEE	GPU-offline,vol=32,parity=1,precision=4,order=2,Ns=2,Nc=24,n_rhs=1	256	1	1	1	1	1	0	-1	-1	-1	-1	9.056e-06	# 0.00 Gflop/s, 2.71 GB/s, tuning took 0.006746 seconds at Thu Jul  3 15:48:53 2025
         1x2x4x4	N4quda4blas12TileSizeTuneINS0_9multiCdotES2_St7complexIdERKNS_10vector_refIKNS_16ColorSpinorFieldEEESA_SA_SA_EE	nested_policy,vol=32,parity=1,precision=4,order=2,Ns=2,Nc=24,vol=32,parity=1,precision=4,order=2,Ns=2,Nc=24,n=4,m=5,multi-blas-n=4,max_nyw_tile=8	32	1	1	1	1	1	0	4	5	0	0	2.02233e-05	# 0.00 Gflop/s, 0.00 GB/s, tuning took 0.018200 seconds at Thu Jul  3 15:48:57 2025
         1x2x4x4	N4quda4blas12TileSizeTuneINS0_9multiCdotES2_St7complexIdERKNS_10vector_refIKNS_16ColorSpinorFieldEEESA_SA_SA_EE	nested_policy,vol=32,parity=1,precision=4,order=2,Ns=2,Nc=24,vol=32,parity=1,precision=4,order=2,Ns=2,Nc=24,n=5,m=4,multi-blas-n=4,max_nyw_tile=8	32	1	1	1	1	1	0	4	4	0	0	3.07113e-05	# 0.00 Gflop/s, 0.00 GB/s, tuning took 0.011607 seconds at Thu Jul  3 15:48:57 2025
         1x2x4x4	N4quda4blas13TransposeTuneINS0_9multiCdotES2_St7complexIdERKNS_10vector_refIKNS_16ColorSpinorFieldEEESA_EE	policy,vol=32,parity=1,precision=4,order=2,Ns=2,Nc=24,vol=32,parity=1,precision=4,order=2,Ns=2,Nc=24,n=4,m=5,multi-blas-n=4,max_nyw_tile=8	32	1	1	1	1	1	0	0	0	0	0	2.13945e-05	# 0.00 Gflop/s, 0.00 GB/s, tuning took 0.002647 seconds at Thu Jul  3 15:48:57 2025
         1x2x4x4	N4quda4blas5Norm2IdfEE	GPU-offline,vol=32,parity=1,precision=4,order=2,Ns=2,Nc=24,n_rhs=1	256	1	1	1	1	1	0	-1	-1	-1	-1	7.96444e-06	# 0.77 Gflop/s, 1.54 GB/s, tuning took 0.006730 seconds at Thu Jul  3 15:48:53 2025
         1x2x4x4	N4quda4blas7axpbyz_IfEE	GPU-offline,vol=32,parity=1,precision=4,order=2,Ns=2,Nc=24,n_rhs=1	640	1	1	56	1	1	0	-1	-1	-1	-1	2.43822e-06	# 3.78 Gflop/s, 15.12 GB/s, tuning took 0.010154 seconds at Thu Jul  3 15:48:57 2025
         1x2x4x4	N4quda4blas9multiCdotIdfEE	policy_kernel,GPU-offline,vol=32,parity=1,precision=4,order=2,Ns=2,Nc=24,Nxz=1,Nyw=1,max_nyw_tile=8	128	1	1	1	1	1	0	-1	-1	-1	-1	9.73616e-06	# 1.26 Gflop/s, 2.52 GB/s, tuning took 0.006886 seconds at Thu Jul  3 15:48:57 2025
         1x2x4x4	N4quda4blas9multiCdotIdfEE	policy_kernel,GPU-offline,vol=32,parity=1,precision=4,order=2,Ns=2,Nc=24,Nxz=1,Nyw=1,max_nyw_tile=8,norm	128	1	1	1	1	1	0	-1	-1	-1	-1	9.65486e-06	# 1.27 Gflop/s, 2.55 GB/s, tuning took 0.024807 seconds at Thu Jul  3 15:48:57 2025
         1x2x4x4	N4quda4blas9multiCdotIdfEE	policy_kernel,GPU-offline,vol=32,parity=1,precision=4,order=2,Ns=2,Nc=24,Nxz=1,Nyw=2,max_nyw_tile=8	128	1	1	1	1	2	0	-1	-1	-1	-1	9.728e-06	# 2.53 Gflop/s, 5.05 GB/s, tuning took 0.012759 seconds at Thu Jul  3 15:48:57 2025
         1x2x4x4	N4quda4blas9multiCdotIdfEE	policy_kernel,GPU-offline,vol=32,parity=1,precision=4,order=2,Ns=2,Nc=24,Nxz=2,Nyw=1,max_nyw_tile=8	128	1	1	1	1	1	0	-1	-1	-1	-1	1.29617e-05	# 1.90 Gflop/s, 2.84 GB/s, tuning took 0.007271 seconds at Thu Jul  3 15:48:57 2025
         1x2x4x4	N4quda4blas9multiCdotIdfEE	policy_kernel,GPU-offline,vol=32,parity=1,precision=4,order=2,Ns=2,Nc=24,Nxz=2,Nyw=2,max_nyw_tile=8	128	1	1	1	1	2	0	-1	-1	-1	-1	1.30076e-05	# 3.78 Gflop/s, 5.67 GB/s, tuning took 0.013621 seconds at Thu Jul  3 15:48:57 2025
         1x2x4x4	N4quda4blas9multiCdotIdfEE	policy_kernel,GPU-offline,vol=32,parity=1,precision=4,order=2,Ns=2,Nc=24,Nxz=2,Nyw=2,max_nyw_tile=8,norm	128	1	1	1	1	2	0	-1	-1	-1	-1	1.28943e-05	# 3.81 Gflop/s, 5.72 GB/s, tuning took 0.013946 seconds at Thu Jul  3 15:48:57 2025
         1x2x4x4	N4quda4blas9multiCdotIdfEE	policy_kernel,GPU-offline,vol=32,parity=1,precision=4,order=2,Ns=2,Nc=24,Nxz=2,Nyw=4,max_nyw_tile=8	128	1	1	1	1	4	0	-1	-1	-1	-1	1.30586e-05	# 7.53 Gflop/s, 11.29 GB/s, tuning took 0.014340 seconds at Thu Jul  3 15:48:57 2025
         1x2x4x4	N4quda4blas9multiCdotIdfEE	policy_kernel,GPU-offline,vol=32,parity=1,precision=4,order=2,Ns=2,Nc=24,Nxz=3,Nyw=4,max_nyw_tile=8	128	1	1	1	1	4	0	-1	-1	-1	-1	1.62817e-05	# 9.06 Gflop/s, 12.08 GB/s, tuning took 0.015908 seconds at Thu Jul  3 15:48:57 2025
         1x2x4x4	N4quda4blas9multiCdotIdfEE	policy_kernel,GPU-offline,vol=32,parity=1,precision=4,order=2,Ns=2,Nc=24,Nxz=4,Nyw=2,max_nyw_tile=8	128	1	1	1	1	2	0	-1	-1	-1	-1	1.95338e-05	# 5.03 Gflop/s, 6.29 GB/s, tuning took 0.015071 seconds at Thu Jul  3 15:48:57 2025
         1x2x4x4	N4quda4blas9multiCdotIdfEE	policy_kernel,GPU-offline,vol=32,parity=1,precision=4,order=2,Ns=2,Nc=24,Nxz=4,Nyw=3,max_nyw_tile=8	128	1	1	1	1	3	0	-1	-1	-1	-1	1.95031e-05	# 7.56 Gflop/s, 9.45 GB/s, tuning took 0.015728 seconds at Thu Jul  3 15:48:57 2025
         1x2x4x4	N4quda4blas9multiCdotIdfEE	policy_kernel,GPU-offline,vol=32,parity=1,precision=4,order=2,Ns=2,Nc=24,Nxz=4,Nyw=5,max_nyw_tile=8	128	1	1	1	1	5	0	-1	-1	-1	-1	1.9665e-05	# 12.50 Gflop/s, 15.62 GB/s, tuning took 0.016606 seconds at Thu Jul  3 15:48:57 2025
               2	N4quda7reducer11init_reduceIN4cuda3__46atomicIjLNS2_3std3__48__detail12thread_scopeE1EEEEE	GPU-offline,	32	1	1	1	1	1	0	-1	-1	-1	-1	3.40282e+38	# default
              24	N4quda7reducer11init_reduceIN4cuda3__46atomicIjLNS2_3std3__48__detail12thread_scopeE1EEEEE	GPU-offline,	32	1	1	1	1	1	0	-1	-1	-1	-1	3.40282e+38	# default
         2x2x4x4	N4quda10CalculateYILb0EL19QudaFieldLocation_s2ENS_13CalculateYArgILb0EfsLi4ELi2ELi3ELi24ENS_5gauge10FieldOrderIfLi48ELi2EL21QudaGaugeFieldOrder_s2ELb1EsEENS4_IfLi48ELi2ELS5_2ELb1EiEENS4_IfLi3ELi1ELS5_2ELb1EfEENS_11colorspinor12FieldOrderCBIfLi4ELi3ELi24EL16QudaFieldOrder_s8EssLb0ELb0EEESC_SC_NS_6clover10FieldOrderIfLi3ELi4EL22QudaCloverFieldOrder_s4EEEEEEE	GPU-offline,vol=65536,parity=2,precision=2,order=8,Ns=4,Nc=72,nVec=24,comm=0000,computeCoarseDiagonal,GPU-device	448	2	1	1	1	24	0	1	1	1	1	2.05422e-06	# 1.50 Gflop/s, 11.96 GB/s, tuning took 0.016924 seconds at Thu Jul  3 15:48:35 2025
         2x2x4x4	N4quda10CalculateYILb0EL19QudaFieldLocation_s2ENS_13CalculateYArgILb0EfsLi4ELi2ELi3ELi24ENS_5gauge10FieldOrderIfLi48ELi2EL21QudaGaugeFieldOrder_s2ELb1EsEENS4_IfLi48ELi2ELS5_2ELb1EiEENS4_IfLi3ELi1ELS5_2ELb1EfEENS_11colorspinor12FieldOrderCBIfLi4ELi3ELi24EL16QudaFieldOrder_s8EssLb0ELb0EEESC_SC_NS_6clover10FieldOrderIfLi3ELi4EL22QudaCloverFieldOrder_s4EEEEEEE	GPU-offline,vol=65536,parity=2,precision=2,order=8,Ns=4,Nc=72,nVec=24,comm=0000,computeConvert,GPU-device	32	3	2	1	16	12	0	1	1	1	1	3.00209e-06	# 1.02 Gflop/s, 589.41 GB/s, tuning took 0.034416 seconds at Thu Jul  3 15:48:16 2025
         2x2x4x4	N4quda10CalculateYILb0EL19QudaFieldLocation_s2ENS_13CalculateYArgILb0EfsLi4ELi2ELi3ELi24ENS_5gauge10FieldOrderIfLi48ELi2EL21QudaGaugeFieldOrder_s2ELb1EsEENS4_IfLi48ELi2ELS5_2ELb1EiEENS4_IfLi3ELi1ELS5_2ELb1EfEENS_11colorspinor12FieldOrderCBIfLi4ELi3ELi24EL16QudaFieldOrder_s8EssLb0ELb0EEESC_SC_NS_6clover10FieldOrderIfLi3ELi4EL22QudaCloverFieldOrder_s4EEEEEEE	GPU-offline,vol=65536,parity=2,precision=2,order=8,Ns=4,Nc=72,nVec=24,comm=0000,computeRescale,GPU-device	32	7	3	1	7	8	0	1	1	1	1	2.56255e-06	# 1.20 Gflop/s, 460.34 GB/s, tuning took 0.035059 seconds at Thu Jul  3 15:48:22 2025
         2x2x4x4	N4quda11SpinorNoiseIfLi2ELi24EEE	GPU-offline,vol=64,parity=2,precision=4,order=2,Ns=2,Nc=24,uniform	128	1	1	1	2	1	4916	-1	-1	-1	-1	9.97878e-06	# 0.00 Gflop/s, 2.46 GB/s, tuning took 0.018312 seconds at Thu Jul  3 15:48:52 2025
         2x2x4x4	N4quda12DslashCoarseIfssLi2ELi24ELb1ELb1ELb0ELNS_10DslashTypeE2EEE	policy_kernel,GPU-offline,vol=64,parity=2,precision=4,order=2,Ns=2,Nc=24,comm=0000,full,halo=00000000,n_rhs=1	128	2	2	2	1	24	8192	8	1	1	1	2.00202e-05	# 530.00 Gflop/s, 277.43 GB/s, tuning took 0.187952 seconds at Thu Jul  3 15:48:53 2025
         2x2x4x4	N4quda12ExtractGhostIsLi48ENS_5gauge10FieldOrderIfLi48ELi1EL21QudaGaugeFieldOrder_s13ELb1EsEEEE	GPU-offline,vol=64,stride=64,precision=2,geometry=8,Nc=48fine-grained,extract	64	7	1	1	7	8	24577	-1	-1	-1	-1	2.21867e-05	# 0.00 Gflop/s, 79.75 GB/s, tuning took 0.096914 seconds at Thu Jul  3 15:48:36 2025
         2x2x4x4	N4quda12ExtractGhostIsLi48ENS_5gauge10FieldOrderIfLi48ELi1EL21QudaGaugeFieldOrder_s2ELb0EsEEEE	GPU-offline,vol=64,stride=64,precision=2,geometry=8,Nc=48fine-grained,extract	32	8	1	1	6	8	0	-1	-1	-1	-1	1.96258e-05	# 0.00 Gflop/s, 90.16 GB/s, tuning took 0.191916 seconds at Thu Jul  3 15:48:36 2025
         2x2x4x4	N4quda12ExtractGhostIsLi48ENS_5gauge10FieldOrderIfLi48ELi1EL21QudaGaugeFieldOrder_s2ELb0EsEEEE	GPU-offline,vol=64,stride=64,precision=2,geometry=8,Nc=48fine-grained,inject	32	2	1	1	24	8	3781	-1	-1	-1	-1	1.85953e-06	# 0.00 Gflop/s, 951.57 GB/s, tuning took 0.020995 seconds at Thu Jul  3 15:48:36 2025
         2x2x4x4	N4quda13CalculateYhatIL19QudaFieldLocation_s2EfsNS_5gauge10FieldOrderIfLi48ELi1EL21QudaGaugeFieldOrder_s13ELb1EsEES5_NS3_IfLi48ELi1ELS4_13ELb1EfEELi48ELi4ELi2ELb0ELb1EEE	GPU-offline,vol=64,stride=64,precision=2,geometry=8,Nc=48,GPU-device,comm=0000,mma,3xfp16,m16n8k8	8	1	1	4	24	96	0	0	0	0	0	8.96e-05	# 5029.30 Gflop/s, 5687.59 GB/s, tuning took 0.001488 seconds at Thu Jul  3 15:48:36 2025
         2x2x4x4	N4quda13CalculateYhatIL19QudaFieldLocation_s2EfsNS_5gauge10FieldOrderIfLi48ELi1EL21QudaGaugeFieldOrder_s13ELb1EsEES5_NS3_IfLi48ELi1ELS4_13ELb1EfEELi48ELi4ELi2ELb1ELb1EEE	GPU-offline,vol=64,stride=64,precision=2,geometry=8,Nc=48,GPU-device,comm=0000,mma,3xfp16,m16n8k8,compute_max	8	1	1	4	24	96	0	0	0	0	0	7.96332e-05	# 5658.76 Gflop/s, 3555.24 GB/s, tuning took 0.017805 seconds at Thu Jul  3 15:48:36 2025
         2x2x4x4	N4quda22DslashCoarsePolicyTuneINS_18DslashCoarseLaunchINS_1DELb0ELi24ELb0ELi1EEEEE	policy,dslashclover,vol=64,parity=2,precision=4,order=2,Ns=2,Nc=24,gauge_prec=2,halo_prec=2,comm=0000,topo=1111,p2p=0,gdr=0,nvshmem=0,pol=11110000000,full,n_rhs=1	32	1	1	1	1	1	0	0	0	0	0	1.99636e-05	# 531.50 Gflop/s, 278.22 GB/s, tuning took 0.004566 seconds at Thu Jul  3 15:48:53 2025
         2x2x4x4	N4quda4blas10caxpyNorm2IdfEE	GPU-offline,vol=64,parity=2,precision=4,order=2,Ns=2,Nc=24,n_rhs=1	256	1	1	2	1	1	0	-1	-1	-1	-1	9.57483e-06	# 5.13 Gflop/s, 7.70 GB/s, tuning took 0.011975 seconds at Thu Jul  3 15:48:53 2025
         2x2x4x4	N4quda4blas12MaxDeviationIdfEE	GPU-offline,vol=64,parity=2,precision=4,order=2,Ns=2,Nc=24,n_rhs=1	256	1	1	2	1	1	0	-1	-1	-1	-1	1.04252e-05	# 0.00 Gflop/s, 4.71 GB/s, tuning took 0.012220 seconds at Thu Jul  3 15:48:53 2025
         2x2x4x4	N4quda4blas5Norm2IdfEE	GPU-offline,vol=64,parity=2,precision=4,order=2,Ns=2,Nc=24,n_rhs=1	256	1	1	2	1	1	0	-1	-1	-1	-1	9.22346e-06	# 1.33 Gflop/s, 2.66 GB/s, tuning took 0.011865 seconds at Thu Jul  3 15:48:53 2025
         2x2x4x4	N4quda4blas5Norm2IdfEE	GPU-offline,vol=64,parity=2,precision=4,order=2,Ns=2,Nc=24,n_rhs=24	256	1	1	1	1	24	0	-1	-1	-1	-1	1.09633e-05	# 26.90 Gflop/s, 53.80 GB/s, tuning took 0.011869 seconds at Thu Jul  3 15:48:52 2025
         2x2x4x4	N4quda7RNGInitE	GPU-offline,vol=64,parity=2,precision=4,order=2,Ns=2,Nc=24	352	1	1	1	2	1	0	-1	-1	-1	-1	0.000574123	# 0.00 Gflop/s, 0.00 GB/s, tuning took 0.076977 seconds at Thu Jul  3 15:48:36 2025
         2x2x4x4	N4quda9CopyGaugeINS_12CopyGaugeArgIffLi4608ELb1ENS_5gauge10FieldOrderIfLi48ELi1EL21QudaGaugeFieldOrder_s13ELb1EfEENS3_IfLi48ELi1ELS4_2ELb1EsEEEEEE	GPU-offline,vol=64,stride=32,precision=2,geometry=1,Nc=48,vol=64,stride=32,precision=4,geometry=1,Nc=48,fine-grained	32	1	1	1	48	2	0	-1	-1	-1	-1	1.50807e-05	# 0.00 Gflop/s, 117.33 GB/s, tuning took 0.023237 seconds at Thu Jul  3 15:48:36 2025
         2x2x4x4	N4quda9CopyGaugeINS_12CopyGaugeArgIffLi4608ELb1ENS_5gauge10FieldOrderIfLi48ELi1EL21QudaGaugeFieldOrder_s13ELb1EsEENS3_IfLi48ELi1ELS4_2ELb1EsEEEEEE	GPU-offline,vol=64,stride=32,precision=2,geometry=1,Nc=48,vol=64,stride=32,precision=2,geometry=1,Nc=48,fine-grained	128	1	1	1	48	2	0	-1	-1	-1	-1	1.4817e-05	# 0.00 Gflop/s, 79.61 GB/s, tuning took 0.023028 seconds at Thu Jul  3 15:48:36 2025
         2x2x4x4	N4quda9CopyGaugeINS_12CopyGaugeArgIffLi4608ELb1ENS_5gauge10FieldOrderIfLi48ELi1EL21QudaGaugeFieldOrder_s13ELb1EsEENS3_IfLi48ELi1ELS4_2ELb1EsEEEEEE	GPU-offline,vol=64,stride=64,precision=2,geometry=8,Nc=48,vol=64,stride=64,precision=2,geometry=8,Nc=48,fine-grained	64	7	2	1	7	8	0	-1	-1	-1	-1	0.00010527	# 0.00 Gflop/s, 179.29 GB/s, tuning took 0.187278 seconds at Thu Jul  3 15:48:36 2025
         2x2x4x4	N4quda9CopyGaugeINS_12CopyGaugeArgIffLi4608ELb1ENS_5gauge10FieldOrderIfLi48ELi1EL21QudaGaugeFieldOrder_s13ELb1EsEENS3_IfLi48ELi1ELS4_2ELb1EsEEEEEE	GPU-offline,vol=64,stride=64,precision=2,geometry=8,Nc=48,vol=64,stride=64,precision=2,geometry=8,Nc=48,fine-grained,ghost	64	1	4	1	48	2	0	-1	-1	-1	-1	2.24825e-05	# 0.00 Gflop/s, 314.82 GB/s, tuning took 0.042673 seconds at Thu Jul  3 15:48:36 2025
         2x2x4x4	N4quda9CopyGaugeINS_12CopyGaugeArgIffLi4608ELb1ENS_5gauge10FieldOrderIfLi48ELi1EL21QudaGaugeFieldOrder_s2ELb0EsEENS3_IfLi48ELi1ELS4_2ELb1EsEEEEEE	GPU-offline,vol=64,stride=64,precision=2,geometry=8,Nc=48,vol=64,stride=64,precision=2,geometry=8,Nc=48,fine-grained,ghost	32	7	1	1	7	8	0	-1	-1	-1	-1	1.90889e-05	# 0.00 Gflop/s, 370.79 GB/s, tuning took 0.037448 seconds at Thu Jul  3 15:48:36 2025
         2x2x4x4	N4quda9CopyGaugeINS_12CopyGaugeArgIffLi4608ELb1ENS_5gauge10FieldOrderIfLi48ELi1EL21QudaGaugeFieldOrder_s2ELb1EsEENS3_IfLi48ELi1ELS4_13ELb1EfEEEEEE	GPU-offline,vol=64,stride=32,precision=4,geometry=1,Nc=48,vol=64,stride=32,precision=2,geometry=1,Nc=48,fine-grained	96	2	2	1	24	1	0	-1	-1	-1	-1	6.88274e-06	# 0.00 Gflop/s, 257.09 GB/s, tuning took 0.017392 seconds at Thu Jul  3 15:48:36 2025
         2x2x4x4	N4quda9CopyGaugeINS_12CopyGaugeArgIffLi4608ELb1ENS_5gauge10FieldOrderIfLi48ELi1EL21QudaGaugeFieldOrder_s2ELb1EsEENS3_IfLi48ELi1ELS4_13ELb1EsEEEEEE	GPU-offline,vol=64,stride=64,precision=2,geometry=8,Nc=48,vol=64,stride=64,precision=2,geometry=8,Nc=48,fine-grained	128	1	2	1	48	8	0	-1	-1	-1	-1	3.76225e-05	# 0.00 Gflop/s, 501.68 GB/s, tuning took 0.062879 seconds at Thu Jul  3 15:48:36 2025
         2x2x4x4	N4quda9CopyGaugeINS_12CopyGaugeArgIffLi4608ELb1ENS_5gauge10FieldOrderIfLi48ELi1EL21QudaGaugeFieldOrder_s2ELb1EsEENS3_IfLi48ELi1ELS4_13ELb1EsEEEEEE	GPU-offline,vol=64,stride=64,precision=2,geometry=8,Nc=48,vol=64,stride=64,precision=2,geometry=8,Nc=48,fine-grained,ghost	32	1	1	1	48	8	0	-1	-1	-1	-1	1.05123e-05	# 0.00 Gflop/s, 673.29 GB/s, tuning took 0.024294 seconds at Thu Jul  3 15:48:36 2025
         2x2x4x4	N4quda9CopyGaugeINS_12CopyGaugeArgIffLi4608ELb1ENS_5gauge10FieldOrderIfLi48ELi1EL21QudaGaugeFieldOrder_s2ELb1EsEENS3_IfLi48ELi1ELS4_2ELb0EsEEEEEE	GPU-offline,vol=64,stride=64,precision=2,geometry=8,Nc=48,vol=64,stride=64,precision=2,geometry=8,Nc=48,fine-grained,ghost	32	3	3	1	16	3	0	-1	-1	-1	-1	2.05799e-05	# 0.00 Gflop/s, 343.92 GB/s, tuning took 0.037295 seconds at Thu Jul  3 15:48:36 2025
2x2x4x4,16x16x16x16	N4quda16ProlongateLaunchIfsLi4ELi3ELi2ELi24EEE	GPU-offline,vol=64,parity=2,precision=4,order=2,Ns=2,Nc=24,vol=65536,parity=2,precision=4,order=4,Ns=4,Nc=3,n_rhs=1,to_non_rel	96	1	3	342	2	1	0	-1	-1	-1	-1	0.000253496	# 595.65 Gflop/s, 324.81 GB/s, tuning took 0.413193 seconds at Thu Jul  3 15:48:53 2025
2x2x4x4,16x16x16x16	N4quda16ProlongateLaunchIfsLi4ELi3ELi2ELi24EEE	GPU-offline,vol=64,parity=2,precision=4,order=2,Ns=2,Nc=24,vol=65536,parity=2,precision=4,order=4,Ns=4,Nc=3,n_rhs=24	32	4	3	1024	12	1	0	-1	-1	-1	-1	0.00203162	# 1783.74 Gflop/s, 972.68 GB/s, tuning took 12.197098 seconds at Thu Jul  3 15:48:50 2025
2x2x4x4,8x16x16x16	N4quda16ProlongateLaunchIfsLi4ELi3ELi2ELi24EEE	GPU-offline,vol=64,parity=2,precision=4,order=2,Ns=2,Nc=24,vol=32768,parity=1,precision=4,order=4,Ns=4,Nc=3,n_rhs=1,to_non_rel	128	1	3	256	1	1	0	-1	-1	-1	-1	0.000128512	# 587.47 Gflop/s, 320.45 GB/s, tuning took 0.158397 seconds at Thu Jul  3 15:48:58 2025
           73728	N4quda15TransformReduceINS_7maximumIfEENS_7complexIfEEjNS_8abs_max_IffEENS_8identityEEE	,batch_size=2	512	1	1	31	1	2	0	-1	-1	-1	-1	7.41667e-06	# 0.00 Gflop/s, 159.05 GB/s, tuning took 0.027371 seconds at Thu Jul  3 15:48:36 2025
           73728	N4quda15TransformReduceINS_7maximumIfEENS_7complexIiEEjNS_8abs_max_IfiEENS_8identityEEE	,batch_size=2	512	1	1	23	1	2	0	-1	-1	-1	-1	7.64849e-06	# 0.00 Gflop/s, 154.23 GB/s, tuning took 0.028809 seconds at Thu Jul  3 15:48:16 2025
      8x16x16x16	N4quda15CopyColorSpinorILi4ELi3ENS_11colorspinor11FloatNOrderIdLi4ELi3ELi2ELb0ELb0ELb0EEES3_St5tupleIJRNS_16ColorSpinorFieldERKS5_19QudaFieldLocation_sPdPKdEEEE	GPU-offline,vol=32768,parity=1,precision=8,order=2,Ns=4,Nc=3vol=32768,parity=1,precision=8,order=2,Ns=4,Nc=3	704	1	1	47	1	1	0	-1	-1	-1	-1	3.92332e-05	# 0.00 Gflop/s, 320.72 GB/s, tuning took 0.015007 seconds at Thu Jul  3 15:48:57 2025
      8x16x16x16	N4quda15CopyColorSpinorILi4ELi3ENS_11colorspinor11FloatNOrderIfLi4ELi3ELi4ELb0ELb0ELb0EEENS2_IdLi4ELi3ELi2ELb0ELb0ELb0EEESt5tupleIJRNS_16ColorSpinorFieldERKS6_19QudaFieldLocation_sPfPKdEEEE	GPU-offline,vol=32768,parity=1,precision=8,order=2,Ns=4,Nc=3vol=32768,parity=1,precision=4,order=4,Ns=4,Nc=3	608	1	1	54	1	1	0	-1	-1	-1	-1	3.05959e-05	# 0.00 Gflop/s, 308.45 GB/s, tuning took 0.016687 seconds at Thu Jul  3 15:48:57 2025
      8x16x16x16	N4quda15CopyColorSpinorILi4ELi3ENS_11colorspinor11FloatNOrderIfLi4ELi3ELi4ELb0ELb0ELb0EEES3_St5tupleIJRNS_16ColorSpinorFieldERKS5_19QudaFieldLocation_sPfPKfEEEE	GPU-offline,vol=32768,parity=1,precision=4,order=4,Ns=4,Nc=3vol=32768,parity=1,precision=4,order=4,Ns=4,Nc=3	608	1	1	54	1	1	0	-1	-1	-1	-1	2.048e-05	# 0.00 Gflop/s, 307.20 GB/s, tuning took 0.016440 seconds at Thu Jul  3 15:47:38 2025
      8x16x16x16	N4quda15CopyColorSpinorILi4ELi3ENS_11colorspinor11FloatNOrderIsLi4ELi3ELi8ELb0ELb0ELb0EEENS2_IfLi4ELi3ELi4ELb0ELb0ELb0EEESt5tupleIJRNS_16ColorSpinorFieldERKS6_19QudaFieldLocation_sPsPKfEEEE	GPU-offline,vol=32768,parity=1,precision=4,order=4,Ns=4,Nc=3vol=32768,parity=1,precision=2,order=8,Ns=4,Nc=3	512	1	1	64	1	1	0	-1	-1	-1	-1	1.5184e-05	# 0.00 Gflop/s, 319.39 GB/s, tuning took 0.012071 seconds at Thu Jul  3 15:47:38 2025
      8x16x16x16	N4quda15CopyColorSpinorILi4ELi3ENS_11colorspinor11FloatNOrderIsLi4ELi3ELi8ELb0ELb0ELb0EEES3_St5tupleIJRNS_16ColorSpinorFieldERKS5_19QudaFieldLocation_sPsPKsEEEE	GPU-offline,vol=32768,parity=1,precision=2,order=8,Ns=4,Nc=3vol=32768,parity=1,precision=2,order=8,Ns=4,Nc=3	96	1	1	342	1	1	0	-1	-1	-1	-1	9.52588e-06	# 0.00 Gflop/s, 357.75 GB/s, tuning took 0.014769 seconds at Thu Jul  3 15:47:38 2025
      8x16x16x16	N4quda26WilsonCloverPreconditionedINS_15WilsonCloverArgIdLi3ELi4EL21QudaReconstructType_s12ELb0EEEEE	policy,GPU-offline,vol=32768,parity=1,precision=8,order=2,Ns=4,Nc=3,commDim=0000,n_rhs=1,n_rhs_tile=1,topo=1111,p2p=0,gdr=0,nvshmem=0,pol=110000000000000000	32	1	1	1	1	1	0	0	0	0	-1	0.000672416	# 91.23 Gflop/s, 134.11 GB/s, tuning took 0.010825 seconds at Thu Jul  3 15:49:43 2025
      8x16x16x16	N4quda26WilsonCloverPreconditionedINS_15WilsonCloverArgIdLi3ELi4EL21QudaReconstructType_s12ELb0EEEEE	policy,GPU-offline,vol=32768,parity=1,precision=8,order=2,Ns=4,Nc=3,commDim=0000,xpay,n_rhs=1,n_rhs_tile=1,topo=1111,p2p=0,gdr=0,nvshmem=0,pol=110000000000000000	32	1	1	1	1	1	0	0	0	0	-1	0.000687104	# 91.56 Gflop/s, 131.24 GB/s, tuning took 0.011018 seconds at Thu Jul  3 15:49:44 2025
      8x16x16x16	N4quda26WilsonCloverPreconditionedINS_15WilsonCloverArgIdLi3ELi4EL21QudaReconstructType_s12ELb0EEEEE	policy_kernel=interior,GPU-offline,vol=32768,parity=1,precision=8,order=2,Ns=4,Nc=3,commDim=0000,n_rhs=1,n_rhs_tile=1,comm=0000	32	1	1	1024	1	1	16897	-1	-1	-1	-1	0.000672768	# 91.18 Gflop/s, 134.04 GB/s, tuning took 0.564502 seconds at Thu Jul  3 15:49:43 2025
      8x16x16x16	N4quda26WilsonCloverPreconditionedINS_15WilsonCloverArgIdLi3ELi4EL21QudaReconstructType_s12ELb0EEEEE	policy_kernel=interior,GPU-offline,vol=32768,parity=1,precision=8,order=2,Ns=4,Nc=3,commDim=0000,xpay,n_rhs=1,n_rhs_tile=1,comm=0000	32	1	1	1024	1	1	16897	-1	-1	-1	-1	0.000687445	# 91.52 Gflop/s, 131.18 GB/s, tuning took 0.487900 seconds at Thu Jul  3 15:49:44 2025
      8x16x16x16	N4quda26WilsonCloverPreconditionedINS_15WilsonCloverArgIfLi3ELi4EL21QudaReconstructType_s12ELb0EEEEE	policy,GPU-offline,vol=32768,parity=1,precision=4,order=4,Ns=4,Nc=3,commDim=0000,dagger,n_rhs=1,n_rhs_tile=1,topo=1111,p2p=0,gdr=0,nvshmem=0,pol=110000000000000000	32	1	1	1	1	1	0	1	0	0	-1	0.0003008	# 203.93 Gflop/s, 149.90 GB/s, tuning took 0.005458 seconds at Thu Jul  3 15:47:38 2025
      8x16x16x16	N4quda26WilsonCloverPreconditionedINS_15WilsonCloverArgIfLi3ELi4EL21QudaReconstructType_s12ELb0EEEEE	policy,GPU-offline,vol=32768,parity=1,precision=4,order=4,Ns=4,Nc=3,commDim=0000,n_rhs=1,n_rhs_tile=1,topo=1111,p2p=0,gdr=0,nvshmem=0,pol=110000000000000000	32	1	1	1	1	1	0	0	0	0	-1	0.0003008	# 203.93 Gflop/s, 149.90 GB/s, tuning took 0.005463 seconds at Thu Jul  3 15:47:37 2025
      8x16x16x16	N4quda26WilsonCloverPreconditionedINS_15WilsonCloverArgIfLi3ELi4EL21QudaReconstructType_s12ELb0EEEEE	policy,GPU-offline,vol=32768,parity=1,precision=4,order=4,Ns=4,Nc=3,commDim=0000,xpay,n_rhs=1,n_rhs_tile=1,topo=1111,p2p=0,gdr=0,nvshmem=0,pol=110000000000000000	32	1	1	1	1	1	0	0	0	0	-1	0.000301568	# 208.62 Gflop/s, 149.51 GB/s, tuning took 0.005469 seconds at Thu Jul  3 15:47:37 2025
      8x16x16x16	N4quda26WilsonCloverPreconditionedINS_15WilsonCloverArgIfLi3ELi4EL21QudaReconstructType_s12ELb0EEEEE	policy_kernel=interior,GPU-offline,vol=32768,parity=1,precision=4,order=4,Ns=4,Nc=3,commDim=0000,dagger,n_rhs=1,n_rhs_tile=1,comm=0000	32	1	1	1024	1	1	16897	-1	-1	-1	-1	0.000300288	# 204.28 Gflop/s, 150.15 GB/s, tuning took 0.269520 seconds at Thu Jul  3 15:47:38 2025
      8x16x16x16	N4quda26WilsonCloverPreconditionedINS_15WilsonCloverArgIfLi3ELi4EL21QudaReconstructType_s12ELb0EEEEE	policy_kernel=interior,GPU-offline,vol=32768,parity=1,precision=4,order=4,Ns=4,Nc=3,commDim=0000,n_rhs=1,n_rhs_tile=1,comm=0000	32	1	1	1024	1	1	16897	-1	-1	-1	-1	0.0003008	# 203.93 Gflop/s, 149.90 GB/s, tuning took 0.340668 seconds at Thu Jul  3 15:47:37 2025
      8x16x16x16	N4quda26WilsonCloverPreconditionedINS_15WilsonCloverArgIfLi3ELi4EL21QudaReconstructType_s12ELb0EEEEE	policy_kernel=interior,GPU-offline,vol=32768,parity=1,precision=4,order=4,Ns=4,Nc=3,commDim=0000,xpay,n_rhs=1,n_rhs_tile=1,comm=0000	32	1	1	1024	1	1	16897	-1	-1	-1	-1	0.000301664	# 208.56 Gflop/s, 149.47 GB/s, tuning took 0.269557 seconds at Thu Jul  3 15:47:37 2025
      8x16x16x16	N4quda26WilsonCloverPreconditionedINS_15WilsonCloverArgIsLi3ELi4EL21QudaReconstructType_s12ELb0EEEEE	policy,GPU-offline,vol=32768,parity=1,precision=2,order=8,Ns=4,Nc=3,commDim=0000,dagger,n_rhs=1,n_rhs_tile=1,topo=1111,p2p=0,gdr=0,nvshmem=0,pol=110000000000000000	32	1	1	1	1	1	0	0	0	0	-1	4.62633e-05	# 1325.93 Gflop/s, 509.97 GB/s, tuning took 0.002540 seconds at Thu Jul  3 15:47:38 2025
      8x16x16x16	N4quda26WilsonCloverPreconditionedINS_15WilsonCloverArgIsLi3ELi4EL21QudaReconstructType_s12ELb0EEEEE	policy,GPU-offline,vol=32768,parity=1,precision=2,order=8,Ns=4,Nc=3,commDim=0000,n_rhs=1,n_rhs_tile=1,topo=1111,p2p=0,gdr=0,nvshmem=0,pol=110000000000000000	32	1	1	1	1	1	0	1	0	0	-1	4.64524e-05	# 1320.53 Gflop/s, 507.90 GB/s, tuning took 0.002610 seconds at Thu Jul  3 15:47:38 2025
      8x16x16x16	N4quda26WilsonCloverPreconditionedINS_15WilsonCloverArgIsLi3ELi4EL21QudaReconstructType_s12ELb0EEEEE	policy,GPU-offline,vol=32768,parity=1,precision=2,order=8,Ns=4,Nc=3,commDim=0000,xpay,n_rhs=1,n_rhs_tile=1,topo=1111,p2p=0,gdr=0,nvshmem=0,pol=110000000000000000	32	1	1	1	1	1	0	1	0	0	-1	5.25472e-05	# 1197.30 Gflop/s, 448.99 GB/s, tuning took 0.002668 seconds at Thu Jul  3 15:47:38 2025
      8x16x16x16	N4quda26WilsonCloverPreconditionedINS_15WilsonCloverArgIsLi3ELi4EL21QudaReconstructType_s12ELb0EEEEE	policy_kernel=interior,GPU-offline,vol=32768,parity=1,precision=2,order=8,Ns=4,Nc=3,commDim=0000,dagger,n_rhs=1,n_rhs_tile=1,comm=0000	32	1	1	1024	1	1	6759	-1	-1	-1	-1	4.62662e-05	# 1325.84 Gflop/s, 509.94 GB/s, tuning took 0.060084 seconds at Thu Jul  3 15:47:38 2025
      8x16x16x16	N4quda26WilsonCloverPreconditionedINS_15WilsonCloverArgIsLi3ELi4EL21QudaReconstructType_s12ELb0EEEEE	policy_kernel=interior,GPU-offline,vol=32768,parity=1,precision=2,order=8,Ns=4,Nc=3,commDim=0000,n_rhs=1,n_rhs_tile=1,comm=0000	32	1	1	1024	1	1	6759	-1	-1	-1	-1	4.63593e-05	# 1323.18 Gflop/s, 508.92 GB/s, tuning took 0.060119 seconds at Thu Jul  3 15:47:38 2025
      8x16x16x16	N4quda26WilsonCloverPreconditionedINS_15WilsonCloverArgIsLi3ELi4EL21QudaReconstructType_s12ELb0EEEEE	policy_kernel=interior,GPU-offline,vol=32768,parity=1,precision=2,order=8,Ns=4,Nc=3,commDim=0000,xpay,n_rhs=1,n_rhs_tile=1,comm=0000	32	1	1	1024	1	1	6759	-1	-1	-1	-1	5.25312e-05	# 1197.66 Gflop/s, 449.12 GB/s, tuning took 0.064779 seconds at Thu Jul  3 15:47:38 2025
      8x16x16x16	N4quda4blas10CdotNormABIdfEE	GPU-offline,vol=32768,parity=1,precision=4,order=4,Ns=4,Nc=3,n_rhs=1	128	1	1	56	1	1	0	-1	-1	-1	-1	5.94522e-05	# 105.82 Gflop/s, 105.82 GB/s, tuning took 0.187918 seconds at Thu Jul  3 15:49:42 2025
      8x16x16x16	N4quda4blas10caxpyNorm2IddEE	GPU-offline,vol=32768,parity=1,precision=8,order=2,Ns=4,Nc=3,n_rhs=1	256	1	1	53	1	1	0	-1	-1	-1	-1	6.6108e-05	# 95.17 Gflop/s, 285.51 GB/s, tuning took 0.226609 seconds at Thu Jul  3 15:49:44 2025
      8x16x16x16	N4quda4blas10caxpyNorm2IdfEE	GPU-offline,vol=32768,parity=1,precision=4,order=4,Ns=4,Nc=3,n_rhs=1	256	1	1	52	1	1	0	-1	-1	-1	-1	3.75502e-05	# 167.55 Gflop/s, 251.32 GB/s, tuning took 0.119741 seconds at Thu Jul  3 15:47:38 2025
      8x16x16x16	N4quda4blas10multiaxpy_IfEE	GPU-offline,vol=32768,parity=1,precision=2,order=8,Ns=4,Nc=3,vol=32768,parity=1,precision=4,order=4,Ns=4,Nc=3,Nxz=1,Nyw=1	640	1	1	56	1	1	0	1	0	0	0	2.42944e-05	# 64.74 Gflop/s, 329.10 GB/s, tuning took 0.033154 seconds at Thu Jul  3 15:47:38 2025
      8x16x16x16	N4quda4blas11axpbyzNorm2IdfEE	GPU-offline,vol=32768,parity=1,precision=2,order=8,Ns=4,Nc=3,n_rhs=1	128	1	1	56	1	1	0	-1	-1	-1	-1	2.88759e-05	# 108.94 Gflop/s, 177.03 GB/s, tuning took 0.073514 seconds at Thu Jul  3 15:47:39 2025
      8x16x16x16	N4quda4blas11multicaxpy_IdEE	GPU-offline,vol=32768,parity=1,precision=4,order=4,Ns=4,Nc=3,vol=32768,parity=1,precision=8,order=2,Ns=4,Nc=3,Nxz=3,Nyw=1	96	1	1	56	1	1	0	1	0	0	0	8.7296e-05	# 108.11 Gflop/s, 252.25 GB/s, tuning took 0.018572 seconds at Thu Jul  3 15:49:42 2025
      8x16x16x16	N4quda4blas11multicaxpy_IfEE	GPU-offline,vol=32768,parity=1,precision=2,order=8,Ns=4,Nc=3,vol=32768,parity=1,precision=4,order=4,Ns=4,Nc=3,Nxz=8,Nyw=1	480	1	1	56	1	1	0	1	0	0	0	6.2266e-05	# 404.17 Gflop/s, 319.97 GB/s, tuning took 0.017341 seconds at Thu Jul  3 15:49:42 2025
      8x16x16x16	N4quda4blas12TileSizeTuneINS0_9multiCdotES2_St7complexIdERKNS_10vector_refIKNS_16ColorSpinorFieldEEESA_SA_SA_EE	nested_policy,vol=32768,parity=1,precision=2,order=8,Ns=4,Nc=3,vol=32768,parity=1,precision=2,order=8,Ns=4,Nc=3,n=8,m=9,multi-blas-n=4,max_nyw_tile=8	32	1	1	1	1	1	0	8	9	0	0	0.00184525	# 0.00 Gflop/s, 0.00 GB/s, tuning took 0.078848 seconds at Thu Jul  3 15:49:22 2025
      8x16x16x16	N4quda4blas12TileSizeTuneINS0_9multiCdotES2_St7complexIdERKNS_10vector_refIKNS_16ColorSpinorFieldEEESA_SA_SA_EE	nested_policy,vol=32768,parity=1,precision=2,order=8,Ns=4,Nc=3,vol=32768,parity=1,precision=2,order=8,Ns=4,Nc=3,n=9,m=8,multi-blas-n=4,max_nyw_tile=8	32	1	1	1	1	1	0	8	8	0	0	0.001991	# 0.00 Gflop/s, 0.00 GB/s, tuning took 0.067192 seconds at Thu Jul  3 15:49:42 2025
      8x16x16x16	N4quda4blas13TransposeTuneINS0_9multiCdotES2_St7complexIdERKNS_10vector_refIKNS_16ColorSpinorFieldEEESA_EE	policy,vol=32768,parity=1,precision=2,order=8,Ns=4,Nc=3,vol=32768,parity=1,precision=2,order=8,Ns=4,Nc=3,n=8,m=9,multi-blas-n=4,max_nyw_tile=8	32	1	1	1	1	1	0	0	0	0	0	0.00184559	# 0.00 Gflop/s, 0.00 GB/s, tuning took 0.026900 seconds at Thu Jul  3 15:49:42 2025
      8x16x16x16	N4quda4blas13cabxpyzaxnormIdfEE	GPU-offline,vol=32768,parity=1,precision=4,order=4,Ns=4,Nc=3,n_rhs=1	128	1	1	55	1	1	0	-1	-1	-1	-1	4.6592e-05	# 168.79 Gflop/s, 270.07 GB/s, tuning took 0.128555 seconds at Thu Jul  3 15:49:42 2025
      8x16x16x16	N4quda4blas15tripleCGUpdate_IfEE	GPU-offline,vol=32768,parity=1,precision=2,order=8,Ns=4,Nc=3,vol=32768,parity=1,precision=4,order=4,Ns=4,Nc=3,n_rhs=1	416	1	1	56	1	1	0	-1	-1	-1	-1	4.64858e-05	# 101.51 Gflop/s, 318.62 GB/s, tuning took 0.017926 seconds at Thu Jul  3 15:47:38 2025
      8x16x16x16	N4quda4blas18tripleCGReduction_IdfEE	GPU-offline,vol=32768,parity=1,precision=2,order=8,Ns=4,Nc=3,n_rhs=1	64	1	1	56	1	1	0	-1	-1	-1	-1	6.3296e-05	# 74.55 Gflop/s, 80.76 GB/s, tuning took 0.177467 seconds at Thu Jul  3 15:47:38 2025
      8x16x16x16	N4quda4blas23HeavyQuarkResidualNorm_IddEE	GPU-offline,vol=32768,parity=1,precision=8,order=2,Ns=4,Nc=3,n_rhs=1	128	1	1	52	1	1	0	-1	-1	-1	-1	4.78248e-05	# 65.78 Gflop/s, 263.10 GB/s, tuning took 0.133410 seconds at Thu Jul  3 15:49:44 2025
      8x16x16x16	N4quda4blas23HeavyQuarkResidualNorm_IdfEE	GPU-offline,vol=32768,parity=1,precision=4,order=4,Ns=4,Nc=3,n_rhs=1	64	1	1	56	1	1	0	-1	-1	-1	-1	5.04688e-05	# 62.33 Gflop/s, 124.66 GB/s, tuning took 0.147734 seconds at Thu Jul  3 15:47:39 2025
      8x16x16x16	N4quda4blas4CdotIdfEE	GPU-offline,vol=32768,parity=1,precision=2,order=8,Ns=4,Nc=3,n_rhs=1	64	1	1	56	1	1	0	-1	-1	-1	-1	4.41934e-05	# 71.18 Gflop/s, 77.11 GB/s, tuning took 0.129031 seconds at Thu Jul  3 15:47:39 2025
      8x16x16x16	N4quda4blas4CdotIdfEE	GPU-offline,vol=32768,parity=1,precision=4,order=4,Ns=4,Nc=3,n_rhs=1	128	1	1	56	1	1	0	-1	-1	-1	-1	4.24107e-05	# 74.17 Gflop/s, 148.35 GB/s, tuning took 0.149039 seconds at Thu Jul  3 15:48:54 2025
      8x16x16x16	N4quda4blas5Norm2IddEE	GPU-offline,vol=32768,parity=1,precision=8,order=2,Ns=4,Nc=3,n_rhs=1	256	1	1	56	1	1	0	-1	-1	-1	-1	2.74543e-05	# 57.29 Gflop/s, 229.16 GB/s, tuning took 0.144270 seconds at Thu Jul  3 15:48:57 2025
      8x16x16x16	N4quda4blas5Norm2IdfEE	GPU-offline,vol=32768,parity=1,precision=4,order=4,Ns=4,Nc=3,n_rhs=1	256	1	1	56	1	1	0	-1	-1	-1	-1	2.5705e-05	# 61.19 Gflop/s, 122.38 GB/s, tuning took 0.119876 seconds at Thu Jul  3 15:47:37 2025
      8x16x16x16	N4quda4blas6caxpy_IfEE	GPU-offline,vol=32768,parity=1,precision=2,order=8,Ns=4,Nc=3,n_rhs=1	320	1	1	56	1	1	0	-1	-1	-1	-1	1.32827e-05	# 236.83 Gflop/s, 384.85 GB/s, tuning took 0.011702 seconds at Thu Jul  3 15:47:39 2025
      8x16x16x16	N4quda4blas6caxpy_IfEE	GPU-offline,vol=32768,parity=1,precision=4,order=4,Ns=4,Nc=3,n_rhs=1	640	1	1	56	1	1	0	-1	-1	-1	-1	3.0689e-05	# 102.50 Gflop/s, 307.51 GB/s, tuning took 0.013969 seconds at Thu Jul  3 15:49:42 2025
      8x16x16x16	N4quda4blas7axpbyz_IfEE	GPU-offline,vol=32768,parity=1,precision=2,order=8,Ns=4,Nc=3,n_rhs=1	192	1	1	56	1	1	0	-1	-1	-1	-1	1.47239e-05	# 160.24 Gflop/s, 347.18 GB/s, tuning took 0.011928 seconds at Thu Jul  3 15:47:39 2025
      8x16x16x16	N4quda4blas7axpbyz_IfEE	GPU-offline,vol=32768,parity=1,precision=4,order=4,Ns=4,Nc=3,n_rhs=1	640	1	1	56	1	1	0	-1	-1	-1	-1	3.09682e-05	# 76.18 Gflop/s, 304.74 GB/s, tuning took 0.014050 seconds at Thu Jul  3 15:47:38 2025
      8x16x16x16	N4quda4blas9axpyZpbx_IfEE	GPU-offline,vol=32768,parity=1,precision=2,order=8,Ns=4,Nc=3,vol=32768,parity=1,precision=4,order=4,Ns=4,Nc=3,n_rhs=1	608	1	1	56	1	1	0	-1	-1	-1	-1	3.58994e-05	# 87.63 Gflop/s, 317.64 GB/s, tuning took 0.013298 seconds at Thu Jul  3 15:47:39 2025
      8x16x16x16	N4quda4blas9multiCdotIdfEE	policy_kernel,GPU-offline,vol=32768,parity=1,precision=2,order=8,Ns=4,Nc=3,Nxz=1,Nyw=1,max_nyw_tile=8	64	1	1	56	1	1	0	-1	-1	-1	-1	4.36689e-05	# 72.04 Gflop/s, 78.04 GB/s, tuning took 0.123495 seconds at Thu Jul  3 15:48:58 2025
      8x16x16x16	N4quda4blas9multiCdotIdfEE	policy_kernel,GPU-offline,vol=32768,parity=1,precision=2,order=8,Ns=4,Nc=3,Nxz=1,Nyw=1,max_nyw_tile=8,norm	64	1	1	56	1	1	0	-1	-1	-1	-1	4.2072e-05	# 74.77 Gflop/s, 81.00 GB/s, tuning took 0.120172 seconds at Thu Jul  3 15:48:58 2025
      8x16x16x16	N4quda4blas9multiCdotIdfEE	policy_kernel,GPU-offline,vol=32768,parity=1,precision=2,order=8,Ns=4,Nc=3,Nxz=1,Nyw=2,max_nyw_tile=8	32	1	2	56	1	1	0	-1	-1	-1	-1	7.62149e-05	# 82.55 Gflop/s, 89.43 GB/s, tuning took 0.314578 seconds at Thu Jul  3 15:49:23 2025
      8x16x16x16	N4quda4blas9multiCdotIdfEE	policy_kernel,GPU-offline,vol=32768,parity=1,precision=2,order=8,Ns=4,Nc=3,Nxz=2,Nyw=1,max_nyw_tile=8	64	1	1	56	1	1	0	-1	-1	-1	-1	7.09486e-05	# 88.68 Gflop/s, 72.05 GB/s, tuning took 0.199022 seconds at Thu Jul  3 15:48:59 2025
      8x16x16x16	N4quda4blas9multiCdotIdfEE	policy_kernel,GPU-offline,vol=32768,parity=1,precision=2,order=8,Ns=4,Nc=3,Nxz=2,Nyw=2,max_nyw_tile=8	32	1	2	56	1	1	0	-1	-1	-1	-1	0.000125824	# 100.00 Gflop/s, 81.25 GB/s, tuning took 0.522491 seconds at Thu Jul  3 15:48:59 2025
      8x16x16x16	N4quda4blas9multiCdotIdfEE	policy_kernel,GPU-offline,vol=32768,parity=1,precision=2,order=8,Ns=4,Nc=3,Nxz=2,Nyw=2,max_nyw_tile=8,norm	32	1	2	56	1	1	0	-1	-1	-1	-1	0.000125816	# 100.01 Gflop/s, 81.26 GB/s, tuning took 0.521274 seconds at Thu Jul  3 15:48:58 2025
      8x16x16x16	N4quda4blas9multiCdotIdfEE	policy_kernel,GPU-offline,vol=32768,parity=1,precision=2,order=8,Ns=4,Nc=3,Nxz=2,Nyw=4,max_nyw_tile=8	32	1	1	49	1	4	0	-1	-1	-1	-1	0.00023936	# 105.14 Gflop/s, 85.42 GB/s, tuning took 1.481099 seconds at Thu Jul  3 15:49:24 2025
      8x16x16x16	N4quda4blas9multiCdotIdfEE	policy_kernel,GPU-offline,vol=32768,parity=1,precision=2,order=8,Ns=4,Nc=3,Nxz=2,Nyw=8,max_nyw_tile=8	32	1	1	21	1	8	0	-1	-1	-1	-1	0.000467968	# 107.55 Gflop/s, 87.39 GB/s, tuning took 4.316088 seconds at Thu Jul  3 15:49:37 2025
      8x16x16x16	N4quda4blas9multiCdotIdfEE	policy_kernel,GPU-offline,vol=32768,parity=1,precision=2,order=8,Ns=4,Nc=3,Nxz=3,Nyw=4,max_nyw_tile=8	32	1	1	21	1	4	0	-1	-1	-1	-1	0.000338603	# 111.48 Gflop/s, 80.52 GB/s, tuning took 1.743216 seconds at Thu Jul  3 15:49:26 2025
      8x16x16x16	N4quda4blas9multiCdotIdfEE	policy_kernel,GPU-offline,vol=32768,parity=1,precision=2,order=8,Ns=4,Nc=3,Nxz=3,Nyw=8,max_nyw_tile=8	32	1	1	21	1	8	0	-1	-1	-1	-1	0.000662603	# 113.94 Gflop/s, 82.29 GB/s, tuning took 5.316707 seconds at Thu Jul  3 15:49:42 2025
      8x16x16x16	N4quda4blas9multiCdotIdfEE	policy_kernel,GPU-offline,vol=32768,parity=1,precision=2,order=8,Ns=4,Nc=3,Nxz=4,Nyw=2,max_nyw_tile=8	32	1	2	56	1	1	0	-1	-1	-1	-1	0.000225075	# 111.81 Gflop/s, 75.71 GB/s, tuning took 0.759688 seconds at Thu Jul  3 15:49:04 2025
      8x16x16x16	N4quda4blas9multiCdotIdfEE	policy_kernel,GPU-offline,vol=32768,parity=1,precision=2,order=8,Ns=4,Nc=3,Nxz=4,Nyw=3,max_nyw_tile=8	32	1	3	56	1	1	0	-1	-1	-1	-1	0.000331776	# 113.78 Gflop/s, 77.04 GB/s, tuning took 1.487946 seconds at Thu Jul  3 15:49:06 2025
      8x16x16x16	N4quda4blas9multiCdotIdfEE	policy_kernel,GPU-offline,vol=32768,parity=1,precision=2,order=8,Ns=4,Nc=3,Nxz=4,Nyw=4,max_nyw_tile=8	32	1	1	21	1	4	0	-1	-1	-1	-1	0.00043696	# 115.19 Gflop/s, 77.99 GB/s, tuning took 2.253489 seconds at Thu Jul  3 15:49:04 2025
      8x16x16x16	N4quda4blas9multiCdotIdfEE	policy_kernel,GPU-offline,vol=32768,parity=1,precision=2,order=8,Ns=4,Nc=3,Nxz=4,Nyw=4,max_nyw_tile=8,norm	32	1	1	21	1	4	0	-1	-1	-1	-1	0.000435552	# 115.56 Gflop/s, 78.24 GB/s, tuning took 2.249176 seconds at Thu Jul  3 15:49:01 2025
      8x16x16x16	N4quda4blas9multiCdotIdfEE	policy_kernel,GPU-offline,vol=32768,parity=1,precision=2,order=8,Ns=4,Nc=3,Nxz=4,Nyw=8,max_nyw_tile=8	32	1	2	21	1	4	0	-1	-1	-1	-1	0.000858155	# 117.30 Gflop/s, 79.42 GB/s, tuning took 6.512187 seconds at Thu Jul  3 15:49:32 2025
      8x16x16x16	N4quda4blas9multiCdotIdfEE	policy_kernel,GPU-offline,vol=32768,parity=1,precision=2,order=8,Ns=4,Nc=3,Nxz=8,Nyw=4,max_nyw_tile=8	32	1	4	28	1	1	0	-1	-1	-1	-1	0.000831776	# 121.02 Gflop/s, 73.75 GB/s, tuning took 3.159753 seconds at Thu Jul  3 15:49:09 2025
      8x16x16x16	N4quda4blas9multiCdotIdfEE	policy_kernel,GPU-offline,vol=32768,parity=1,precision=2,order=8,Ns=4,Nc=3,Nxz=8,Nyw=5,max_nyw_tile=8	32	1	5	28	1	1	0	-1	-1	-1	-1	0.00104044	# 120.94 Gflop/s, 73.70 GB/s, tuning took 4.424369 seconds at Thu Jul  3 15:49:13 2025
      8x16x16x16	N4quda4blas9multiCdotIdfEE	policy_kernel,GPU-offline,vol=32768,parity=1,precision=2,order=8,Ns=4,Nc=3,Nxz=8,Nyw=9,max_nyw_tile=8	32	1	3	28	1	3	0	-1	-1	-1	-1	0.00184286	# 122.90 Gflop/s, 74.89 GB/s, tuning took 8.819498 seconds at Thu Jul  3 15:49:22 2025
      8x16x16x16	N4quda6CloverIdLi3EEE	GPU-offline,vol=32768,parity=1,precision=8,order=2,Ns=4,Nc=3,n_rhs=1	32	1	1	1024	1	1	3511	-1	-1	-1	-1	0.00027264	# 60.57 Gflop/s, 100.00 GB/s, tuning took 0.113393 seconds at Thu Jul  3 15:48:56 2025
      8x16x16x16	N4quda6CloverIfLi3EEE	GPU-offline,vol=32768,parity=1,precision=4,order=4,Ns=4,Nc=3,n_rhs=1	32	1	1	1024	1	1	3781	-1	-1	-1	-1	0.000294656	# 56.05 Gflop/s, 46.26 GB/s, tuning took 0.123145 seconds at Thu Jul  3 15:47:36 2025
      8x16x16x16	N4quda6CloverIsLi3EEE	GPU-offline,vol=32768,parity=1,precision=2,order=8,Ns=4,Nc=3,n_rhs=1	96	1	1	342	1	1	0	-1	-1	-1	-1	2.41764e-05	# 683.11 Gflop/s, 292.76 GB/s, tuning took 0.024383 seconds at Thu Jul  3 15:47:38 2025
      8x16x16x16	N4quda6WilsonINS_9WilsonArgIdLi3ELi4EL21QudaReconstructType_s12ELb0EEEEE	policy,GPU-offline,vol=32768,parity=1,precision=8,order=2,Ns=4,Nc=3,commDim=0000,xpay,n_rhs=1,n_rhs_tile=1,topo=1111,p2p=0,gdr=0,nvshmem=0,pol=110000000000000000	32	1	1	1	1	1	0	0	0	0	-1	0.00042064	# 106.57 Gflop/s, 179.48 GB/s, tuning took 0.006780 seconds at Thu Jul  3 15:48:57 2025
      8x16x16x16	N4quda6WilsonINS_9WilsonArgIdLi3ELi4EL21QudaReconstructType_s12ELb0EEEEE	policy_kernel=interior,GPU-offline,vol=32768,parity=1,precision=8,order=2,Ns=4,Nc=3,commDim=0000,xpay,n_rhs=1,n_rhs_tile=1,comm=0000	32	1	1	1024	1	1	16897	-1	-1	-1	-1	0.000420864	# 106.51 Gflop/s, 179.39 GB/s, tuning took 0.354506 seconds at Thu Jul  3 15:48:57 2025
      8x16x16x16	N4quda6WilsonINS_9WilsonArgIfLi3ELi4EL21QudaReconstructType_s12ELb0EEEEE	policy,GPU-offline,vol=32768,parity=1,precision=4,order=4,Ns=4,Nc=3,commDim=0000,xpay,dagger,n_rhs=1,n_rhs_tile=1,topo=1111,p2p=0,gdr=0,nvshmem=0,pol=110000000000000000	32	1	1	1	1	1	0	0	0	0	-1	7.31429e-05	# 612.86 Gflop/s, 516.10 GB/s, tuning took 0.002822 seconds at Thu Jul  3 15:47:38 2025
      8x16x16x16	N4quda6WilsonINS_9WilsonArgIfLi3ELi4EL21QudaReconstructType_s12ELb0EEEEE	policy,GPU-offline,vol=32768,parity=1,precision=4,order=4,Ns=4,Nc=3,commDim=0000,xpay,n_rhs=1,n_rhs_tile=1,topo=1111,p2p=0,gdr=0,nvshmem=0,pol=110000000000000000	32	1	1	1	1	1	0	0	0	0	-1	7.24114e-05	# 619.05 Gflop/s, 521.31 GB/s, tuning took 0.002806 seconds at Thu Jul  3 15:47:37 2025
      8x16x16x16	N4quda6WilsonINS_9WilsonArgIfLi3ELi4EL21QudaReconstructType_s12ELb0EEEEE	policy_kernel=interior,GPU-offline,vol=32768,parity=1,precision=4,order=4,Ns=4,Nc=3,commDim=0000,xpay,dagger,n_rhs=1,n_rhs_tile=1,comm=0000	16	1	1	2048	1	1	6337	-1	-1	-1	-1	7.31429e-05	# 612.86 Gflop/s, 516.10 GB/s, tuning took 0.093848 seconds at Thu Jul  3 15:47:38 2025
      8x16x16x16	N4quda6WilsonINS_9WilsonArgIfLi3ELi4EL21QudaReconstructType_s12ELb0EEEEE	policy_kernel=interior,GPU-offline,vol=32768,parity=1,precision=4,order=4,Ns=4,Nc=3,commDim=0000,xpay,n_rhs=1,n_rhs_tile=1,comm=0000	16	1	1	2048	1	1	6337	-1	-1	-1	-1	7.24731e-05	# 618.53 Gflop/s, 520.87 GB/s, tuning took 0.222631 seconds at Thu Jul  3 15:47:37 2025
      8x16x16x16	N4quda6WilsonINS_9WilsonArgIsLi3ELi4EL21QudaReconstructType_s12ELb0EEEEE	policy,GPU-offline,vol=32768,parity=1,precision=2,order=8,Ns=4,Nc=3,commDim=0000,xpay,dagger,n_rhs=1,n_rhs_tile=1,topo=1111,p2p=0,gdr=0,nvshmem=0,pol=110000000000000000	32	1	1	1	1	1	0	1	0	0	-1	4.05094e-05	# 1106.57 Gflop/s, 491.81 GB/s, tuning took 0.002469 seconds at Thu Jul  3 15:47:38 2025
      8x16x16x16	N4quda6WilsonINS_9WilsonArgIsLi3ELi4EL21QudaReconstructType_s12ELb0EEEEE	policy_kernel=interior,GPU-offline,vol=32768,parity=1,precision=2,order=8,Ns=4,Nc=3,commDim=0000,xpay,dagger,n_rhs=1,n_rhs_tile=1,comm=0000	80	1	1	410	1	1	16897	-1	-1	-1	-1	4.04874e-05	# 1107.18 Gflop/s, 492.08 GB/s, tuning took 0.055372 seconds at Thu Jul  3 15:47:38 2025
8x16x16x16,2x2x4x4	N4quda14RestrictLaunchIffsLi4ELi3ELi2ELi24EEE	GPU-offline,vol=32768,parity=1,precision=4,order=4,Ns=4,Nc=3,vol=64,parity=2,precision=4,order=2,Ns=2,Nc=24,n_rhs=1,from_non_rel	64	1	6	64	1	1	0	48	-1	-1	-1	0.000134784	# 560.14 Gflop/s, 305.53 GB/s, tuning took 0.154871 seconds at Thu Jul  3 15:48:57 2025
         9437184	N4quda15TransformReduceINS_7maximumIfEENS_7complexIsEEjNS_8abs_max_IfsEENS_8identityEEE	,batch_size=2	512	1	1	42	1	2	0	-1	-1	-1	-1	0.000237363	# 0.00 Gflop/s, 318.07 GB/s, tuning took 2.553993 seconds at Thu Jul  3 15:47:43 2025
      bytes=1024	cudaMemcpyHostToDevice	BatchInvertMatrix,blas_lapack_cublas.cpp,125	32	1	1	1	1	1	0	-1	-1	-1	-1	4.88974e-06	# 0.00 Gflop/s, 0.21 GB/s, tuning took 0.000697 seconds at Thu Jul  3 15:48:36 2025
   bytes=1179648	cudaMemset	zero,gauge_field.cpp,1186	32	1	1	1	1	1	0	-1	-1	-1	-1	3.16813e-06	# 0.00 Gflop/s, 372.35 GB/s, tuning took 0.014191 seconds at Thu Jul  3 15:48:13 2025
     bytes=12288	cudaMemsetAsync	zero,color_spinor_field.cpp,414	32	1	1	1	1	1	0	-1	-1	-1	-1	1.69252e-06	# 0.00 Gflop/s, 7.26 GB/s, tuning took 0.000798 seconds at Thu Jul  3 15:48:57 2025
  bytes=12582912	cudaMemsetAsync	zero,color_spinor_field.cpp,414	32	1	1	1	1	1	0	-1	-1	-1	-1	3.83212e-05	# 0.00 Gflop/s, 328.35 GB/s, tuning took 0.001172 seconds at Thu Jul  3 15:48:56 2025
    bytes=147456	cudaMemcpyDeviceToDevice	exchangeGhost,gauge_field.cpp,527	32	1	1	1	1	1	0	-1	-1	-1	-1	2.35743e-06	# 0.00 Gflop/s, 125.10 GB/s, tuning took 0.000784 seconds at Thu Jul  3 15:48:36 2025
    bytes=147456	cudaMemcpyDeviceToDevice	exchangeGhost,gauge_field.cpp,536	32	1	1	1	1	1	0	-1	-1	-1	-1	2.35642e-06	# 0.00 Gflop/s, 125.15 GB/s, tuning took 0.000795 seconds at Thu Jul  3 15:48:36 2025
    bytes=147456	cudaMemset	create,gauge_field.cpp,219	32	1	1	1	1	1	0	-1	-1	-1	-1	1.74331e-06	# 0.00 Gflop/s, 84.58 GB/s, tuning took 0.000592 seconds at Thu Jul  3 15:47:43 2025
    bytes=147456	cudaMemset	create,gauge_field.cpp,220	32	1	1	1	1	1	0	-1	-1	-1	-1	1.73943e-06	# 0.00 Gflop/s, 84.77 GB/s, tuning took 0.000677 seconds at Thu Jul  3 15:47:43 2025
   bytes=1572864	cudaMemset	allocateGhostBuffer,lattice_field.cpp,278	32	1	1	1	1	1	0	-1	-1	-1	-1	3.51522e-06	# 0.00 Gflop/s, 447.44 GB/s, tuning took 0.000725 seconds at Thu Jul  3 15:47:08 2025
   bytes=1572864	cudaMemset	allocateGhostBuffer,lattice_field.cpp,283	32	1	1	1	1	1	0	-1	-1	-1	-1	3.51086e-06	# 0.00 Gflop/s, 448.00 GB/s, tuning took 0.000728 seconds at Thu Jul  3 15:47:08 2025
   bytes=1703936	cudaMemsetAsync	zero,color_spinor_field.cpp,414	32	1	1	1	1	1	0	-1	-1	-1	-1	3.52e-06	# 0.00 Gflop/s, 484.07 GB/s, tuning took 0.000827 seconds at Thu Jul  3 15:47:38 2025
     bytes=24576	cudaMemsetAsync	zero,color_spinor_field.cpp,414	32	1	1	1	1	1	0	-1	-1	-1	-1	1.95622e-06	# 0.00 Gflop/s, 12.56 GB/s, tuning took 0.013005 seconds at Thu Jul  3 15:47:43 2025
       bytes=256	cudaMemcpyDeviceToHost	BatchInvertMatrix,blas_lapack_cublas.cpp,133	32	1	1	1	1	1	0	-1	-1	-1	-1	4.59229e-06	# 0.00 Gflop/s, 0.06 GB/s, tuning took 0.000908 seconds at Thu Jul  3 15:48:36 2025
       bytes=256	cudaMemcpyDeviceToHost	BatchInvertMatrix,blas_lapack_cublas.cpp,149	32	1	1	1	1	1	0	-1	-1	-1	-1	4.608e-06	# 0.00 Gflop/s, 0.06 GB/s, tuning took 0.000941 seconds at Thu Jul  3 15:48:36 2025
    bytes=262144	cudaMemcpyHostToDevice	createGeoMap,transfer.cpp,239	32	1	1	1	1	1	0	-1	-1	-1	-1	2.09665e-05	# 0.00 Gflop/s, 12.50 GB/s, tuning took 0.001035 seconds at Thu Jul  3 15:47:40 2025
    bytes=262144	cudaMemcpyHostToDevice	createGeoMap,transfer.cpp,240	32	1	1	1	1	1	0	-1	-1	-1	-1	1.9904e-05	# 0.00 Gflop/s, 13.17 GB/s, tuning took 0.001052 seconds at Thu Jul  3 15:47:40 2025
    bytes=294912	cudaMemcpyDeviceToDevice	exchangeGhost,gauge_field.cpp,527	32	1	1	1	1	1	0	-1	-1	-1	-1	2.30034e-06	# 0.00 Gflop/s, 256.41 GB/s, tuning took 0.000679 seconds at Thu Jul  3 15:48:36 2025
    bytes=294912	cudaMemcpyDeviceToDevice	exchangeGhost,gauge_field.cpp,536	32	1	1	1	1	1	0	-1	-1	-1	-1	2.28594e-06	# 0.00 Gflop/s, 258.02 GB/s, tuning took 0.000772 seconds at Thu Jul  3 15:48:36 2025
    bytes=294912	cudaMemset	create,gauge_field.cpp,219	32	1	1	1	1	1	0	-1	-1	-1	-1	1.7674e-06	# 0.00 Gflop/s, 166.86 GB/s, tuning took 0.000527 seconds at Thu Jul  3 15:47:43 2025
    bytes=294912	cudaMemset	create,gauge_field.cpp,220	32	1	1	1	1	1	0	-1	-1	-1	-1	1.76319e-06	# 0.00 Gflop/s, 167.26 GB/s, tuning took 0.000713 seconds at Thu Jul  3 15:47:43 2025
   bytes=3145728	cudaMemsetAsync	zero,color_spinor_field.cpp,414	32	1	1	1	1	1	0	-1	-1	-1	-1	1.06948e-05	# 0.00 Gflop/s, 294.14 GB/s, tuning took 0.001025 seconds at Thu Jul  3 15:47:36 2025
    bytes=393216	cudaMemcpyDeviceToDevice	exchangeGhost,gauge_field.cpp,527	32	1	1	1	1	1	0	-1	-1	-1	-1	2.25407e-06	# 0.00 Gflop/s, 348.89 GB/s, tuning took 0.000763 seconds at Thu Jul  3 15:47:08 2025
         bytes=4	cudaMemsetAsync	Launch,coarse_op.cuh,393	32	1	1	1	1	1	0	-1	-1	-1	-1	1.49017e-06	# 0.00 Gflop/s, 0.00 GB/s, tuning took 0.000613 seconds at Thu Jul  3 15:47:58 2025
         bytes=4	cudaMemsetAsync	apply,coarse_op_preconditioned_24.cu,82	32	1	1	1	1	1	0	-1	-1	-1	-1	1.21247e-06	# 0.00 Gflop/s, 0.00 GB/s, tuning took 0.000613 seconds at Thu Jul  3 15:48:36 2025
    bytes=589824	cudaMemset	zero,gauge_field.cpp,1186	32	1	1	1	1	1	0	-1	-1	-1	-1	2.26011e-06	# 0.00 Gflop/s, 260.97 GB/s, tuning took 0.000661 seconds at Thu Jul  3 15:47:43 2025
   bytes=6291456	cudaMemsetAsync	zero,color_spinor_field.cpp,414	32	1	1	1	1	1	0	-1	-1	-1	-1	1.99367e-05	# 0.00 Gflop/s, 315.57 GB/s, tuning took 0.003213 seconds at Thu Jul  3 15:47:36 2025
  bytes=75759616	cudaMemsetAsync	zero,color_spinor_field.cpp,414	32	1	1	1	1	1	0	-1	-1	-1	-1	0.000223232	# 0.00 Gflop/s, 339.38 GB/s, tuning took 0.002030 seconds at Thu Jul  3 15:47:43 2025
   bytes=9437184	cudaMemcpyDefault	copy,gauge_field.cpp,1085	32	1	1	1	1	1	0	-1	-1	-1	-1	0.000645461	# 0.00 Gflop/s, 14.62 GB/s, tuning took 0.004850 seconds at Thu Jul  3 15:45:18 2025
   bytes=9437184	cudaMemcpyDeviceToHost	copy,gauge_field.cpp,1024	32	1	1	1	1	1	0	-1	-1	-1	-1	0.000945472	# 0.00 Gflop/s, 9.98 GB/s, tuning took 0.006878 seconds at Thu Jul  3 15:45:21 2025
   bytes=9437184	cudaMemset	zero,gauge_field.cpp,1186	32	1	1	1	1	1	0	-1	-1	-1	-1	3.04107e-05	# 0.00 Gflop/s, 310.32 GB/s, tuning took 0.001150 seconds at Thu Jul  3 15:47:43 2025
